[09/02/2022, 17:33:04] Elliot: ‎Messages and calls are end-to-end encrypted. No one outside of this chat, not even WhatsApp, can read or listen to them.
[09/02/2022, 17:33:04] Elliot: Hi ya
‎[09/02/2022, 17:33:05] Elliot: ‎<attached: 00000003-STICKER-2022-02-09-17-33-05.webp>
[09/02/2022, 20:23:20] .: Filth
[09/02/2022, 20:23:26] .: Hiya
[09/02/2022, 20:25:08] .: Had a nightmare of a day chasing parcels all over the place and a 60 year old man had just come to my door with my mattress what they deleiverd to his house. They didn’t even knock here
[09/02/2022, 20:25:25] .: 5 doors down
[09/02/2022, 20:25:30] .: Idle bastards
[09/02/2022, 20:32:31] Elliot: Ha ha ha ha omfg
[09/02/2022, 20:32:44] Elliot: Bet it’s his d one
[09/02/2022, 20:32:49] Elliot: Old
[09/02/2022, 20:33:01] Elliot: Piss stains, shot and spunk all over it ha ha
[09/02/2022, 20:33:05] Elliot: And bed bugs
[09/02/2022, 20:33:09] Elliot: Ha ha
‎[09/02/2022, 20:33:23] Elliot: ‎<attached: 00000015-STICKER-2022-02-09-20-33-23.webp>
[09/02/2022, 20:34:29] .: No came all wrapped up on a Better note leggings Lorraine I’d missing her legging
[09/02/2022, 20:34:42] .: Coz I have them on lol
‎[09/02/2022, 20:35:06] .: ‎<attached: 00000018-PHOTO-2022-02-09-20-35-06.jpg>
[09/02/2022, 20:35:08] Elliot: I didn’t understand a word of that
[09/02/2022, 20:35:49] .: Some ones fucking leggings ended up in my other parcel
[09/02/2022, 20:36:03] Elliot: Eeeewwwww omg
[09/02/2022, 20:36:14] Elliot: You should wear them when we go out babes
‎[09/02/2022, 20:36:24] Elliot: ‎<attached: 00000023-STICKER-2022-02-09-20-36-24.webp>
[09/02/2022, 20:36:27] .: I didn’t know I had a Lycra fetish
[09/02/2022, 20:36:40] Elliot: Omg you got a stuffy
[09/02/2022, 20:36:47] Elliot: Stiffy
[09/02/2022, 20:36:56] .: No lol
[09/02/2022, 20:37:01] .: Talking to you
[09/02/2022, 20:37:06] .: Feel sick
‎[09/02/2022, 20:46:26] Elliot: ‎<attached: 00000030-STICKER-2022-02-09-20-46-26.webp>
[09/02/2022, 20:46:50] .: Wtf have
[09/02/2022, 20:47:07] Elliot: Working…. Meeting meeting meetings
[09/02/2022, 20:47:16] Elliot: Just getting back from one now
[09/02/2022, 20:47:19] Elliot: 😵‍💫😵‍💫😵‍💫😵‍💫
[09/02/2022, 23:49:29] .: They about buying it. You best be
[10/02/2022, 07:59:51] Elliot: 😉
‎[10/02/2022, 13:24:27] .: ‎<attached: 00000037-PHOTO-2022-02-10-13-24-27.jpg>
[10/02/2022, 13:25:12] Elliot: Well that’s wrong
[10/02/2022, 13:25:25] Elliot: Should be 
FUCKING RANCID SLAG
‎[10/02/2022, 13:25:35] Elliot: ‎<attached: 00000040-STICKER-2022-02-10-13-25-35.webp>
[10/02/2022, 20:28:21] .: Oh no
[10/02/2022, 20:29:02] Elliot: You soiled yourself?
[10/02/2022, 20:29:09] .: Not yet
[10/02/2022, 20:29:16] Elliot: Oh ok
[10/02/2022, 20:29:18] Elliot: 👍🏻
[10/02/2022, 20:29:34] .: Guess what personality Ive gone into
[10/02/2022, 20:29:47] Elliot: Porn star
[10/02/2022, 20:29:52] Elliot: Vile wanker
[10/02/2022, 20:29:59] Elliot: Charming and happy
[10/02/2022, 20:30:04] Elliot: Love for Elliot
[10/02/2022, 20:30:07] .: Tri-annual it’s time to redecorate the flat
[10/02/2022, 20:30:13] .: Personality
[10/02/2022, 20:30:15] Elliot: Omfg
[10/02/2022, 20:30:23] Elliot: What colour ?
[10/02/2022, 20:30:25] Elliot: Black ?
[10/02/2022, 20:30:30] .: Not far off
[10/02/2022, 20:30:36] Elliot: Omg
[10/02/2022, 20:30:40] Elliot: Prison gray
[10/02/2022, 20:30:45] .: No that’s now
‎[10/02/2022, 20:30:51] Elliot: ‎<attached: 00000060-STICKER-2022-02-10-20-30-51.webp>
[10/02/2022, 20:30:58] .: Well manhattan grey
‎[10/02/2022, 20:31:07] Elliot: ‎<attached: 00000062-STICKER-2022-02-10-20-31-07.webp>
[10/02/2022, 20:31:16] Elliot: Errr nice
[10/02/2022, 20:31:19] Elliot: 🤮
[10/02/2022, 20:31:32] .: What Color’s your flat again
[10/02/2022, 20:32:20] Elliot: Squid ink,  something blue, something green, mole skin and something different blue
[10/02/2022, 20:32:27] .: Omg
[10/02/2022, 20:32:31] Elliot: Lol
[10/02/2022, 20:32:47] .: I’ve picked blueberry blue
[10/02/2022, 20:32:55] Elliot: Oooo sounds nice
[10/02/2022, 20:33:03] .: Very nice
[10/02/2022, 20:33:25] Elliot: Not sure what our blue is… blue is very calming… glad we painted it that colour
[10/02/2022, 20:34:05] .: Yeah it feels cold with this grey but even though that blue is darker it’s warmer for some reason.
[10/02/2022, 20:34:49] Elliot: Yeah… little legs was worried about being darker… I think it brings the walls in and makes it cozy
[10/02/2022, 20:37:05] .: That’s fine as long as they don’t start talking to me lol
[10/02/2022, 20:37:45] Elliot: Lol… omg what pills you on again ?! 😵‍💫😵‍💫😵‍💫
‎[10/02/2022, 20:37:52] Elliot: ‎<attached: 00000077-STICKER-2022-02-10-20-37-52.webp>
[10/02/2022, 20:38:14] .: Quezaps or something
[10/02/2022, 20:46:24] Elliot: Give me 5 NOW
[10/02/2022, 21:15:55] .: Nice
[10/02/2022, 21:16:00] .: U can have some
[10/02/2022, 21:16:22] .: One tablet last week last some days
[10/02/2022, 21:16:26] Elliot: Bring them over NOW
[10/02/2022, 21:16:46] .: U will be asleep
[10/02/2022, 21:17:09] Elliot: No
‎[10/02/2022, 21:17:16] Elliot: ‎<attached: 00000086-STICKER-2022-02-10-21-17-16.webp>
‎[10/02/2022, 22:21:58] Elliot: ‎<attached: 00000087-PHOTO-2022-02-10-22-21-58.jpg>
[11/02/2022, 12:42:42] .: Camp
[11/02/2022, 13:22:31] Elliot: Ha ha
‎[11/02/2022, 13:22:35] Elliot: ‎<attached: 00000090-STICKER-2022-02-11-13-22-35.webp>
[11/02/2022, 19:33:21] .: Wtf…..
‎[11/02/2022, 19:41:57] Elliot: ‎<attached: 00000092-PHOTO-2022-02-11-19-41-57.jpg>
[12/02/2022, 13:39:20] .: Disgusting dirty basted
[12/02/2022, 13:43:14] Elliot: He he
[12/02/2022, 13:43:19] Elliot: You off to Trade ?
[12/02/2022, 13:43:31] .: Et
[12/02/2022, 13:43:34] .: Ey?
‎[12/02/2022, 13:44:31] Elliot: ‎<attached: 00000098-STICKER-2022-02-12-13-44-31.webp>
[12/02/2022, 13:44:36] Elliot: 3.30am
[12/02/2022, 13:44:57] .: Nonce disco
[12/02/2022, 13:45:35] Elliot: Clear the room… off to Beyond ha ha ha
[12/02/2022, 13:49:37] .: Lol
[12/02/2022, 13:49:47] .: I feel like beyond lol
[12/02/2022, 13:50:06] Elliot: I need to go out and dance… but it’s going to have to wait
[12/02/2022, 13:50:16] Elliot: Until there’s something to celebrate 🎉
[12/02/2022, 13:50:51] .: Why wait
[12/02/2022, 13:51:05] Elliot: Lol true
[12/02/2022, 14:52:06] .: When’s that gay nigger party on
[12/02/2022, 15:01:02] Elliot: Omg what one ?
[12/02/2022, 15:01:24] .: What’s at electrowoks
[12/02/2022, 15:01:55] Elliot: Wats the party called ?
[12/02/2022, 15:01:57] .: Not nigger, unicorns
[12/02/2022, 15:02:01] .: That’s it
[12/02/2022, 15:02:23] Elliot: Omg lol
[12/02/2022, 15:02:27] .: Haha
‎[12/02/2022, 15:02:29] Elliot: ‎<attached: 00000116-PHOTO-2022-02-12-15-02-29.jpg>
[12/02/2022, 15:02:37] .: Niggercorns
[12/02/2022, 17:25:44] .: The fuck are you doing
[12/02/2022, 17:26:22] Elliot: Trying to stop my boss from canceling everything at the fucking club lol
[12/02/2022, 17:26:35] .: Why
[12/02/2022, 17:30:42] Elliot: Oh about the state the party  left the club in and this….
‎[12/02/2022, 17:30:48] Elliot: ‎<attached: 00000122-PHOTO-2022-02-12-17-30-48.jpg>
[12/02/2022, 17:31:36] .: Who put that up
[12/02/2022, 17:35:54] Elliot: They were all over the place, put up by the promoters
[12/02/2022, 19:11:29] .: At last unicorn ?
[12/02/2022, 19:43:05] Elliot: Could,  potentially, derail the whole thing
[12/02/2022, 20:35:59] .: Oh dear
[12/02/2022, 20:36:53] Elliot: Lol
[12/02/2022, 20:37:09] .: Mind tbh I got given a book about g last time I went to the docs and it said in the back of that take half a capful
[12/02/2022, 20:37:24] .: How the fuck do you know how much it holds I complained
[12/02/2022, 20:37:36] Elliot: Lol omg
[12/02/2022, 20:38:57] Elliot: Don’t worry babes I’ll save it
[12/02/2022, 20:39:05] Elliot: That place will be MINE
[12/02/2022, 20:39:10] Elliot: he he
‎[12/02/2022, 20:39:27] Elliot: ‎video omitted
[12/02/2022, 22:10:16] .: Are u at egg
[12/02/2022, 22:10:47] Elliot: Are you fucking stupid
[12/02/2022, 22:11:02] Elliot: Ha ha no babes.. I’ll never go back to that dump
‎[12/02/2022, 22:11:12] Elliot: ‎video omitted
[12/02/2022, 22:11:14] Elliot: Lol
[13/02/2022, 00:17:38] .: Bless
[13/02/2022, 00:17:42] .: How’s work
[13/02/2022, 00:40:19] Elliot: I’m in bed babes
[13/02/2022, 00:40:26] Elliot: Worked last night he he
[13/02/2022, 17:39:54] .: Wel wel wel
[13/02/2022, 17:41:39] Elliot: Wel well well
[13/02/2022, 17:41:44] Elliot: How was trade ?
[13/02/2022, 17:41:58] .: How was beyond
[13/02/2022, 17:43:37] Elliot: Amazing
[13/02/2022, 17:43:42] Elliot: He he
[13/02/2022, 17:43:48] Elliot: Good speed and acid
[13/02/2022, 17:43:50] Elliot: Oops
[13/02/2022, 17:43:57] Elliot: I’ll get you another one lol
[13/02/2022, 17:45:40] .: Get me another what?
[13/02/2022, 17:45:53] Elliot: Oh lol nothing babes
[13/02/2022, 17:46:05] .: U fucking little bitch
[13/02/2022, 17:49:28] Elliot: Ha ha ha ha
[13/02/2022, 17:50:06] .: Where the fuck did you go
[13/02/2022, 17:50:20] .: And I’ve got a major dilemma
[13/02/2022, 17:51:32] Elliot: Staying in babes, wouldn’t go out without you or having asked you…. ❤️
[13/02/2022, 17:51:57] Elliot: Let me help you
[13/02/2022, 17:51:58] .: Why I’ve not said no for ages I’m getting board
[13/02/2022, 17:52:01] .: Haha
[13/02/2022, 17:52:21] Elliot: I’ve not asked for ages… what’s on next Saturday ?
[13/02/2022, 17:52:38] .: I’ve said yea to that
[13/02/2022, 17:53:17] Elliot: I was so tired last night…. Mentioned zodiac to little legs at 7pm then woke up at 12am lol
[13/02/2022, 17:53:30] Elliot: Ok, where ?
[13/02/2022, 17:53:43] .: Dunno where was it agai ?
[13/02/2022, 17:54:18] Elliot: Round corner from us
[13/02/2022, 17:54:36] .: Oh though you was being sarcastic lol and I’d actually agreed to go somewhere
[13/02/2022, 17:54:36] Elliot: What is this ?
[13/02/2022, 17:54:57] .: Well I don’t know what to wear next time we meet
[13/02/2022, 17:55:50] Elliot: Omfg
[13/02/2022, 17:56:05] Elliot: I’ll think about it and maybe take you shopping
[13/02/2022, 18:01:30] Elliot: Go to dog shit and find out if Katie is still there
[13/02/2022, 18:01:37] Elliot: And that security man
[13/02/2022, 18:01:39] Elliot: NOW
[13/02/2022, 18:15:48] .: Il get wet
[13/02/2022, 18:15:56] Elliot: Ha ha
‎[13/02/2022, 18:16:03] Elliot: ‎<attached: 00000180-STICKER-2022-02-13-18-16-03.webp>
[14/02/2022, 15:46:56] .: Omg
[14/02/2022, 15:47:09] Elliot: Hi ya
‎[14/02/2022, 15:47:22] Elliot: ‎<attached: 00000184-STICKER-2022-02-14-15-47-22.webp>
[14/02/2022, 15:47:26] .: I’ve just forgot what I was omg at
[14/02/2022, 15:47:33] Elliot: Ha ha Hax
[14/02/2022, 15:47:37] Elliot: Watch it again
[14/02/2022, 15:47:38] .: Oh yea
[14/02/2022, 15:47:42] .: War
[14/02/2022, 15:47:52] Elliot: Oh ha ha yeah let’s go !!!
[14/02/2022, 15:47:53] .: We at war not checked news for a well
[14/02/2022, 15:47:57] .: Week
[14/02/2022, 15:48:05] Elliot: No not yet
[14/02/2022, 15:48:11] Elliot: Won’t be us anyway lol
[14/02/2022, 15:48:13] .: Fucking kicking off
[14/02/2022, 15:49:33] Elliot: Who is
[14/02/2022, 16:11:39] .: That Russian Ukrainian bitch fight lol
[14/02/2022, 16:22:14] Elliot: Kill them all ha ha ha
‎[14/02/2022, 17:17:50] .: ‎<attached: 00000199-PHOTO-2022-02-14-17-17-50.jpg>
[14/02/2022, 17:18:13] .: NONCE
[14/02/2022, 17:18:37] Elliot: Eeeewwww
‎[16/02/2022, 11:24:51] Elliot: ‎<attached: 00000202-PHOTO-2022-02-16-11-24-51.jpg>
[16/02/2022, 11:25:30] .: That’s a good one
[16/02/2022, 11:45:13] .: Where the fuck are you
[16/02/2022, 11:49:02] Elliot: I’m at home babes
[16/02/2022, 11:49:12] Elliot: My sister is up, it’s her birthday
[16/02/2022, 11:49:16] Elliot: Where the fuck r u
[16/02/2022, 11:50:13] .: Home
[16/02/2022, 11:50:39] .: Tell your sis I hope she has a shit bday and happy one year closer to death BAM
[16/02/2022, 12:03:39] Elliot: Ok
[16/02/2022, 12:03:46] Elliot: She said thanks babes 😘
[16/02/2022, 12:03:52] Elliot: What the fuck you doing
[16/02/2022, 12:03:54] Elliot: NOW
‎[16/02/2022, 12:06:47] .: ‎<attached: 00000214-PHOTO-2022-02-16-12-06-47.jpg>
[16/02/2022, 12:18:02] Elliot: Eeeeewww
[16/02/2022, 12:18:16] Elliot: Aaahh decorating
‎[16/02/2022, 15:05:53] .: ‎<attached: 00000217-PHOTO-2022-02-16-15-05-53.jpg>
[16/02/2022, 15:19:07] Elliot: Ha ha ha
[16/02/2022, 22:31:09] .: Well the day I had to come to Euston near yours and you chose to spend it with your sister you lousy bastard you!
[16/02/2022, 23:27:08] Elliot: Omfg
[16/02/2022, 23:27:11] Elliot: One now
‎[17/02/2022, 07:20:11] Elliot: ‎<attached: 00000222-PHOTO-2022-02-17-07-20-11.jpg>
[17/02/2022, 11:15:47] .: Disgusting
‎[17/02/2022, 11:25:24] .: ‎<attached: 00000224-PHOTO-2022-02-17-11-25-24.jpg>
[17/02/2022, 11:37:23] Elliot: Oooooo looks nice
[17/02/2022, 11:37:30] Elliot: What it like on the wall !?
[17/02/2022, 11:39:02] .: I’m just taping everything up will do a patch behind the sofa to see
[17/02/2022, 11:39:22] Elliot: Very professional
[17/02/2022, 11:39:27] Elliot: Then send me pic
[17/02/2022, 11:39:41] Elliot: Nice colour….
‎[17/02/2022, 11:39:46] .: ‎<attached: 00000231-PHOTO-2022-02-17-11-39-46.jpg>
[17/02/2022, 11:39:48] Elliot: I like it
[17/02/2022, 11:40:33] .: Omg that radiot looks filthy now I’ve sanded it
[17/02/2022, 11:40:48] Elliot: Replace it
‎[17/02/2022, 11:40:52] Elliot: ‎<attached: 00000235-STICKER-2022-02-17-11-40-52.webp>
[17/02/2022, 11:40:58] .: Painting it lol
[18/02/2022, 13:03:40] .: What…
‎[18/02/2022, 13:03:51] Elliot: ‎<attached: 00000238-STICKER-2022-02-18-13-03-51.webp>
‎[18/02/2022, 13:04:04] Elliot: ‎<attached: 00000239-PHOTO-2022-02-18-13-04-04.jpg>
[18/02/2022, 14:47:04] .: Lol
[18/02/2022, 14:48:13] .: Why u back on therm
[18/02/2022, 14:48:19] .: Them?
[18/02/2022, 14:48:34] Elliot: Back on them ?
[18/02/2022, 14:48:45] .: Taking the piss
[18/02/2022, 14:48:58] Elliot: Why not… they are cunts
[18/02/2022, 16:22:49] .: True babes
[18/02/2022, 16:22:56] .: Wtf are you doin g
[18/02/2022, 16:24:28] Elliot: Just woke up babes
[18/02/2022, 16:25:28] Elliot: Go look on Trade nightclub hall of fame… see all the complaints 🤣🤣🤣🤣👍🏻
[18/02/2022, 16:25:41] .: Where
‎[18/02/2022, 16:25:41] Elliot: ‎<attached: 00000252-STICKER-2022-02-18-16-25-41.webp>
[18/02/2022, 16:25:48] Elliot: FB
[18/02/2022, 16:25:49] .: Trip advisor
[18/02/2022, 16:25:51] .: Ok
[18/02/2022, 16:25:57] Elliot: That’s just half of me
[18/02/2022, 16:26:08] Elliot: Oops *them
[18/02/2022, 16:26:27] .: Thought u meant you are half a wanker
[18/02/2022, 16:26:28] .: Lol
[18/02/2022, 16:27:01] Elliot: No babes…. FULL ON
[18/02/2022, 16:27:05] Elliot: Cum in my face
‎[18/02/2022, 16:34:39] .: ‎<attached: 00000262-PHOTO-2022-02-18-16-34-39.jpg>
[18/02/2022, 16:34:43] .: BAM
[18/02/2022, 16:35:17] Elliot: Omg ha ha ha ha ha
[18/02/2022, 16:38:42] Elliot: Show me the color of your walls NOW
[18/02/2022, 17:35:06] .: Not finished yet
[18/02/2022, 17:47:56] Elliot: 🙄
[18/02/2022, 18:44:00] .: I will say you kinda need to have perfect walls with this paint
[18/02/2022, 18:59:40] Elliot: Lol omg
[18/02/2022, 18:59:46] Elliot: What have you done ?
[18/02/2022, 19:19:12] .: No I mean it shows any imperfection up
[18/02/2022, 19:19:48] Elliot: Oh lol…. Adds Character
[18/02/2022, 19:21:12] .: What my patch work from when I illegally messed with electrics
[18/02/2022, 19:21:16] .: Lol
[18/02/2022, 19:21:38] Elliot: Omg yeah I forgot that
[18/02/2022, 19:21:44] Elliot: Put a picture over it
[18/02/2022, 19:22:15] .: Yeah next to the door way over to the left out of place lol
[18/02/2022, 19:22:25] .: It’s character babes
‎[18/02/2022, 19:23:03] Elliot: ‎<attached: 00000279-STICKER-2022-02-18-19-23-03.webp>
[18/02/2022, 19:23:08] .: Mmmmmm
[18/02/2022, 19:23:12] .: I’d suck it
‎[18/02/2022, 19:23:25] Elliot: ‎<attached: 00000282-STICKER-2022-02-18-19-23-25.webp>
‎[18/02/2022, 19:23:49] .: ‎<attached: 00000283-PHOTO-2022-02-18-19-23-49.jpg>
‎[18/02/2022, 19:23:54] .: ‎<attached: 00000284-PHOTO-2022-02-18-19-23-54.jpg>
‎[18/02/2022, 19:23:57] .: ‎<attached: 00000285-PHOTO-2022-02-18-19-23-57.jpg>
[18/02/2022, 19:24:05] .: Been offered that one
[18/02/2022, 19:24:12] .: I said can’t I’m busy
[18/02/2022, 19:24:20] .: Glossy cock
[18/02/2022, 19:24:21] .: Lol
[18/02/2022, 19:24:28] Elliot: Lol omg
[18/02/2022, 19:24:34] Elliot: What does he look like
[18/02/2022, 19:24:40] .: Dunno
[18/02/2022, 19:24:43] Elliot: Bet he looks like Chrissy
[18/02/2022, 19:24:45] Elliot: Ha ha ha
[18/02/2022, 19:25:03] .: Who cares il gloss my eye balls
[18/02/2022, 19:25:09] .: BAM
[18/02/2022, 19:25:09] Elliot: Ha ha
‎[18/02/2022, 19:25:15] Elliot: ‎<attached: 00000298-STICKER-2022-02-18-19-25-15.webp>
[18/02/2022, 19:27:03] .: Wooooo it’s dark
[18/02/2022, 19:27:06] Elliot: YOU 
https://www.facebook.com/198650096517/posts/10160306326241518/?d=n
‎[18/02/2022, 21:09:02] Elliot: ‎video omitted
[18/02/2022, 21:15:17] .: Disgust
[18/02/2022, 21:15:19] .: Ting
[19/02/2022, 01:07:31] Elliot: Eeeeeswww ugly naked guy from Dog shit is here
[19/02/2022, 12:42:06] .: Omg kick him in the bolloxs
[19/02/2022, 12:48:02] Elliot: 🤮🤮
[19/02/2022, 14:39:42] .: Suck my tits
[19/02/2022, 14:39:51] Elliot: Omfg
[19/02/2022, 17:19:32] Elliot: Ooop gossip
[19/02/2022, 19:01:22] .: Hey go go gossip
[19/02/2022, 19:01:29] .: Been painting
[19/02/2022, 19:04:35] Elliot: Apparently… James, ( glendora James) is the new agar manager at Eagle
[19/02/2022, 19:05:29] .: Agar?
[19/02/2022, 19:05:54] Elliot: Who ?
[19/02/2022, 19:06:00] .: You put it
[19/02/2022, 19:06:20] Elliot: Oh ha ha ha sorry BAR
[19/02/2022, 19:06:39] .: Oh I’m like area manager they only have one bar
[19/02/2022, 19:06:49] Elliot: Ha Hax
[19/02/2022, 19:06:56] .: Dunno not spoke to him for ages
[19/02/2022, 19:07:08] Elliot: Found out from Lucy !
[19/02/2022, 19:07:20] Elliot: I’ve asked her to find out if Katy is still there
[19/02/2022, 19:07:26] .: Lucy?
[19/02/2022, 19:07:34] .: Lesbo
[19/02/2022, 19:07:39] Elliot: Omfg
[19/02/2022, 19:07:41] Elliot: Lucy
[19/02/2022, 19:07:43] Elliot: From egg
[19/02/2022, 19:07:45] .: Oh
[19/02/2022, 19:08:00] Elliot: You been sniffing that paint ?
[19/02/2022, 19:08:10] .: No forgot she exsisted
[19/02/2022, 19:08:22] .: Haha
[19/02/2022, 19:08:51] .: No I didn’t think she would know James or anything about the eagle
[19/02/2022, 19:14:54] Elliot: Yeah that’s what I said but she had some gay security guy working at Trade… he told her
[20/02/2022, 00:30:33] .: And just where in the fuck do you think you are?
[20/02/2022, 00:30:49] Elliot: He he
[20/02/2022, 00:31:01] Elliot: Are Zodiac
[20/02/2022, 00:31:15] Elliot: At even 😵‍💫
[20/02/2022, 00:37:50] .: Fucking bastards
[20/02/2022, 00:38:06] Elliot: Lol… why ? 
You busy painting babes
[20/02/2022, 00:38:12] Elliot: Didn’t want to disturb
[20/02/2022, 00:38:15] Elliot: 😘
[20/02/2022, 00:38:53] .: I’m in the cloud actually
[20/02/2022, 00:39:28] Elliot: Lol ok that to
[20/02/2022, 00:39:41] Elliot: Paint, cloud, blue
[20/02/2022, 00:39:43] Elliot: Plaster
[20/02/2022, 00:39:47] Elliot: Same thing
[20/02/2022, 00:39:49] Elliot: He he
[20/02/2022, 17:39:34] .: How was beyond
[20/02/2022, 17:40:02] Elliot: Amazing
[20/02/2022, 17:40:07] Elliot: Everyone fucking
[20/02/2022, 17:40:13] Elliot: Everywhere
‎[20/02/2022, 17:40:16] Elliot: ‎<attached: 00000351-STICKER-2022-02-20-17-40-16.webp>
[20/02/2022, 17:40:18] .: Disgusting
[20/02/2022, 17:40:40] Elliot: Ha ha ha
[20/02/2022, 17:40:55] .: I spoke to my friend he said it was full of cunts I thought Andrew and Elliot went then
[20/02/2022, 17:40:57] Elliot: Was in bed by 1.30am babes
‎[20/02/2022, 17:41:14] Elliot: ‎<attached: 00000356-PHOTO-2022-02-20-17-41-14.jpg>
[20/02/2022, 17:41:15] .: Lies
[21/02/2022, 11:51:48] .: Do you know how Jamal died
[21/02/2022, 11:51:55] .: Oh hi as well
[21/02/2022, 11:53:08] Elliot: Yeah, cardiac arrest
[21/02/2022, 11:53:24] .: Drugs then
[21/02/2022, 11:54:12] Elliot: Maybe… not sure if he actually did them
[21/02/2022, 11:58:05] .: AnywY back to us
[21/02/2022, 11:58:15] .: Wtf……
[21/02/2022, 11:58:52] Elliot: Lol
[21/02/2022, 11:59:32] Elliot: Just got back from Gym, now ordering stock for the club then going out in the wind NAKED
‎[21/02/2022, 16:51:34] .: ‎<attached: 00000367-PHOTO-2022-02-21-16-51-33.jpg>
[21/02/2022, 16:51:41] .: Oh yeah forgot
[21/02/2022, 16:52:08] .: Hmmmmm I’m not sure on the Color one min then next I like it
[21/02/2022, 16:56:14] Elliot: Looks good, like ours ha ha… maybe get a radiator cover or paint then the same color as the walls ?
[21/02/2022, 16:57:03] Elliot: Putting a few pictures up will brake it up and make it more homely
[21/02/2022, 17:07:57] .: Yeah I’ve got to put all them up
[21/02/2022, 17:24:10] Elliot: Do it NOW
[23/02/2022, 14:13:12] .: You little bitch
[23/02/2022, 14:14:48] .: Where the fuck have you been
What the fuck have you been doing

What the fuck is happening with my nightclub you are buying me?
[23/02/2022, 14:15:17] Elliot: Hi ya
[23/02/2022, 14:16:48] Elliot: Andrew and Gareth are speaking with the accountant as I type this to you… looking through the clubs debts etc, the next step is to discuss and put forward our plan to the current owner next week, if the accounts don’t scare us off ha ha
[23/02/2022, 14:17:07] Elliot: Right now I’m off to the shops 😘
[23/02/2022, 14:17:09] .: Who the fuck is Gareth
[23/02/2022, 14:17:15] Elliot: Omg
[23/02/2022, 14:17:27] Elliot: Ha ha he’s part of our team babes
[23/02/2022, 14:17:39] Elliot: Used to be the GM at XXL
[23/02/2022, 14:17:45] .: Who cares
[23/02/2022, 14:17:49] Elliot: Ha ha
[23/02/2022, 14:17:50] .: Just buy it
[23/02/2022, 14:18:15] Elliot: Need to have a plan first
[23/02/2022, 14:18:27] .: Yeah I suppose
[23/02/2022, 14:18:39] .: I have a plan
[23/02/2022, 14:18:47] Elliot: Tell me
[23/02/2022, 14:18:56] .: I got robbed
[23/02/2022, 14:19:14] .: So I’m going to go a murder him
[23/02/2022, 14:19:39] Elliot: Omg ha ha ok
[23/02/2022, 14:19:43] Elliot: Who robbed you ?
[23/02/2022, 14:19:50] .: A dealer
[23/02/2022, 14:19:57] Elliot: Omfg
[23/02/2022, 14:20:03] Elliot: How much
[23/02/2022, 14:20:08] .: 150
[23/02/2022, 14:20:14] Elliot: You stupid cow
[23/02/2022, 14:20:28] Elliot: Did he try Fuck you ?
[23/02/2022, 14:21:25] .: No I’ve been using him for ages never had any problems at all till yesterday
[23/02/2022, 14:21:49] Elliot: Call the police
[23/02/2022, 14:22:05] Elliot: Tell them your dealer Robbed you
[23/02/2022, 14:22:16] .: Nope that will backfire on me
[23/02/2022, 14:22:21] Elliot: Lol
[23/02/2022, 14:22:39] .: Il already hiding from them lot as it is
‎[23/02/2022, 14:22:42] Elliot: ‎<attached: 00000406-PHOTO-2022-02-23-14-22-42.jpg>
[23/02/2022, 14:23:05] .: Awww I love you too
[23/02/2022, 14:23:34] Elliot: Omg why now ?!
[23/02/2022, 14:25:29] .: Well I think I am I told my psychiatrist team this morning and then remembered them telling me if I ever said anything like that they would call the police
[23/02/2022, 14:25:41] .: Remembered after I said it lol
[23/02/2022, 14:25:47] .: Alzheimer’s
[23/02/2022, 14:26:03] Elliot: Ha ha omg
[23/02/2022, 14:26:31] Elliot: The rozzers are after you
[23/02/2022, 14:26:44] .: Dunno
[23/02/2022, 14:26:51] .: Or the white coats
[23/02/2022, 14:27:10] Elliot: Both
[23/02/2022, 14:27:29] Elliot: It’s ok we got plenty of places to bid you in the club babes
[23/02/2022, 14:27:51] .: I was gunna say I’m coming to yours for tea
[23/02/2022, 14:28:09] Elliot: Today ?
[23/02/2022, 14:28:10] Elliot: Ok
[23/02/2022, 14:28:15] Elliot: What time ?
[23/02/2022, 14:30:38] .: Well I was going to suggest today but I’ve been up since 5 planning lol so what are you doing tomorrow? I’m meeting my sister and the kids in the afternoon at some point
[23/02/2022, 14:31:01] Elliot: Come round anytime babes
[23/02/2022, 14:31:14] Elliot: Tomorrow, gym and house work…
[23/02/2022, 14:31:45] Elliot: Might pop up to the club see if the stock has been put away properly, but I can do that any time
[23/02/2022, 14:33:23] .: Yeah I will come I need to get out this house for a bit
[23/02/2022, 14:34:42] Elliot: Ok
[23/02/2022, 14:34:56] Elliot: Just let us know when your coming x
[24/02/2022, 11:45:53] Elliot: S
[24/02/2022, 11:45:55] Elliot: L
[24/02/2022, 11:45:56] Elliot: A
[24/02/2022, 11:45:57] Elliot: G
[24/02/2022, 11:45:59] Elliot: N
[24/02/2022, 11:46:01] Elliot: O
[24/02/2022, 11:46:02] Elliot: W
[24/02/2022, 11:46:05] Elliot: H
[24/02/2022, 11:46:06] Elliot: E
[24/02/2022, 11:46:07] Elliot: H
[24/02/2022, 11:46:11] Elliot: E
‎[24/02/2022, 11:46:15] Elliot: ‎<attached: 00000440-STICKER-2022-02-24-11-46-15.webp>
[24/02/2022, 12:18:09] .: I’m going to meet my sister t the mall/  buck palace area then will message you to see what your doing huh
[24/02/2022, 12:21:36] Elliot: Ok what time are you meeting her ?
[24/02/2022, 12:21:39] Elliot: Tell me NOW
[24/02/2022, 12:22:05] .: When I meet her lol I’m getting ready as we speak
[24/02/2022, 12:22:54] .: Why what the fuck do you want
[24/02/2022, 12:23:27] Elliot: Goingvv CD to meet Lucy around 2 to discuss yesterday’s meeting with the accountant
[24/02/2022, 12:23:37] Elliot: Omg going to meet
[24/02/2022, 12:24:55] .: More fucking staff team members what I need to know
[24/02/2022, 12:25:09] .: What I haven’t been consulted about
[24/02/2022, 12:25:26] Elliot: It’s complicated
[24/02/2022, 12:30:23] .: Yeah it’s complicating my head
[24/02/2022, 12:30:50] Elliot: Yeah… well, if you want this club then you got to give us money
[24/02/2022, 12:30:58] .: Which is not not hard
[24/02/2022, 12:31:07] .: I’ve tmgot money
[24/02/2022, 12:31:16] .: Yours lol
[24/02/2022, 12:31:18] Elliot: Oh dear
‎[24/02/2022, 12:31:22] Elliot: ‎<attached: 00000457-STICKER-2022-02-24-12-31-22.webp>
[24/02/2022, 12:31:23] .: Just buy it
[24/02/2022, 12:31:33] Elliot: Errrrr….
‎[24/02/2022, 12:31:42] Elliot: ‎<attached: 00000460-PHOTO-2022-02-24-12-31-42.jpg>
[24/02/2022, 12:32:19] .: Was that last Friday
[24/02/2022, 12:32:36] Elliot: Yeah, busy apparently
[24/02/2022, 12:32:50] .: I seen that pic on instagram
[24/02/2022, 12:32:51] .: Lol
[24/02/2022, 12:32:55] Elliot: He he
[24/02/2022, 12:33:29] .: Luwhata with that guys ear
[24/02/2022, 12:33:34] .: Lol
[24/02/2022, 15:02:07] .: Where are
[24/02/2022, 15:02:10] .: You
[24/02/2022, 15:15:02] Elliot: In KIngs Cross station
[24/02/2022, 15:16:06] .: What doing
[24/02/2022, 15:16:47] Elliot: With Lucy, just finishing our meeting
[24/02/2022, 15:16:50] Elliot: Where r u ?
[24/02/2022, 15:35:20] .: Hamleys are you going home ?
‎[24/02/2022, 15:36:10] Elliot: ‎<attached: 00000475-PHOTO-2022-02-24-15-36-10.jpg>
[24/02/2022, 15:36:29] Elliot: Omg another fucking unicorn thing ?
[24/02/2022, 15:37:15] .: lol I’ve had 2 Stella i want to head butt someone
[24/02/2022, 15:37:40] Elliot: Omg
[24/02/2022, 16:33:04] .: Right not going on about it but seeing my family has upset me so I’ve come home are you free tomorrow
[24/02/2022, 16:43:14] Elliot: Yes… come round tomorrow  1pm
[24/02/2022, 16:43:28] Elliot: Or we can meet up outside somewhere
[24/02/2022, 16:43:34] Elliot: Up to you babes xx
[24/02/2022, 16:44:23] .: Err inside lol it’s feeezing
[24/02/2022, 16:47:33] Elliot: Yeah
[25/02/2022, 12:28:08] .: Right
[25/02/2022, 12:28:17] Elliot: Hi ya
[25/02/2022, 12:28:21] .: Still on for 4 1
[25/02/2022, 12:28:33] Elliot: Make it 1/2 1
[25/02/2022, 12:28:39] Elliot: Just about to get in bath
[25/02/2022, 12:28:45] Elliot: Unless you want to join me
[25/02/2022, 12:28:47] Elliot: He he
[25/02/2022, 12:28:55] Elliot: NAKED
[25/02/2022, 12:29:56] .: Il go hostipal first now
[25/02/2022, 12:30:01] Elliot: Ok ok ok
[25/02/2022, 12:30:07] Elliot: UCH ?
[25/02/2022, 13:05:50] .: Yeah lol
[25/02/2022, 13:24:04] Elliot: He he ok ok ok
[26/02/2022, 15:58:33] .: How was work you slag
[26/02/2022, 16:00:57] Elliot: Hi ya
[26/02/2022, 16:01:04] Elliot: Work was amazing babes
[26/02/2022, 16:01:11] Elliot: How was your night ?
[26/02/2022, 16:01:44] .: I can home got in bed woke up.  At 2 this afternoon
[26/02/2022, 16:02:05] Elliot: Slag
[26/02/2022, 16:02:20] .: Way to much socialising
[26/02/2022, 16:36:31] Elliot: Yeah exhausting
‎[28/02/2022, 17:42:12] .: ‎<attached: 00000506-PHOTO-2022-02-28-17-42-12.jpg>
[28/02/2022, 17:42:59] .: And just where the fuck do you think you been
[28/02/2022, 17:44:06] Elliot: Meetings babes
[28/02/2022, 17:44:11] Elliot: And stock take
‎[28/02/2022, 17:44:43] Elliot: ‎<attached: 00000510-STICKER-2022-02-28-17-44-43.webp>
‎[28/02/2022, 17:44:47] Elliot: ‎<attached: 00000511-PHOTO-2022-02-28-17-44-47.jpg>
‎[28/02/2022, 17:44:55] Elliot: ‎<attached: 00000512-PHOTO-2022-02-28-17-44-55.jpg>
[28/02/2022, 17:45:36] .: Why the fuck have you got broke condoms with nigger babies in them haginging from the ceiling
[28/02/2022, 17:46:27] Elliot: Ha ha that was the decs for Trough
[28/02/2022, 17:46:40] .: How was it
[28/02/2022, 17:47:49] Elliot: Really cool… packed
[28/02/2022, 17:48:06] Elliot: Felt a bit like XXL in the courtyard
‎[28/02/2022, 17:48:25] Elliot: ‎<attached: 00000518-PHOTO-2022-02-28-17-48-25.jpg>
[28/02/2022, 17:48:26] .: Yeah it’s that crowd too
[28/02/2022, 17:48:43] .: Filth and desperation
[28/02/2022, 17:48:48] .: Thanks for invite
[28/02/2022, 17:49:00] Elliot: Good party, no over douses not k holes no problems
[28/02/2022, 17:49:14] Elliot: Just lots of banging in bogs lol
[28/02/2022, 17:49:27] .: See id have made that party
[28/02/2022, 17:49:30] Elliot: Ha ha yeah
[28/02/2022, 17:49:33] .: Shame
[28/02/2022, 17:49:43] Elliot: Darkroom was packed
[28/02/2022, 17:49:54] .: You always in there
[28/02/2022, 17:50:00] .: Is it an older crowd
[28/02/2022, 17:50:04] Elliot: No sausage was ha ha
[28/02/2022, 17:50:42] Elliot: It really, a few fattys and older bears but mainly Middle Age, bit different to XXL crowed
[28/02/2022, 17:51:12] Elliot: Lots of 25 something’s all hungry for dick
[28/02/2022, 17:52:43] .: Same
[28/02/2022, 17:53:06] Elliot: Unicorn Friday
[28/02/2022, 17:53:28] .: Do you think I want to go anywhere near a unicorn
[28/02/2022, 17:53:30] .: Huh
[28/02/2022, 17:54:38] Elliot: Lol, I’m just saying 🦄
[28/02/2022, 17:55:02] .: May come dressed as one
[28/02/2022, 17:55:17] Elliot: Camp
[28/02/2022, 17:55:38] .: Go to chesterfield and nick avas
[28/02/2022, 17:55:45] .: Tie it to my head
[28/02/2022, 17:56:16] .: Run around screaming nnnnnreeyyyyyyyy throwing glitter at people having sex
[28/02/2022, 17:57:17] Elliot: Ok cool looking forward to it
‎[01/03/2022, 16:28:22] .: ‎<attached: 00000544-PHOTO-2022-03-01-16-28-22.jpg>
[01/03/2022, 16:31:37] Elliot: Omg… trying out your outfit for Friday ?
‎[01/03/2022, 16:31:53] Elliot: ‎<attached: 00000546-PHOTO-2022-03-01-16-31-53.jpg>
[01/03/2022, 16:34:24] .: Yes
[01/03/2022, 16:34:37] .: My bum hole
[01/03/2022, 16:35:00] Elliot: Gorgeous, you will get a lot of attention babes
[01/03/2022, 16:35:10] Elliot: More wart I’d say
[01/03/2022, 22:31:46] .: Yeah my anus anyway we probably won’t even be here they scared he gunna do something during the state of he union later
[01/03/2022, 22:41:09] Elliot: What time
[01/03/2022, 22:48:23] .: Will be going as dust it’s about 1-2 our time
[01/03/2022, 22:49:05] Elliot: Oh ok… I’ll be in bed by then… I’ll see what it’s like out in the morning
[01/03/2022, 22:49:18] .: Get ya duster out
[01/03/2022, 22:49:46] .: If I am dust I’m gunna be that dust what’s flies through your windows
[01/03/2022, 22:49:47] .: Hehe
[01/03/2022, 22:49:51] Elliot: Got the air humidifier on
[01/03/2022, 22:50:05] Elliot: Suck you off ha ha
[01/03/2022, 22:50:09] .: Oooooooo
‎[01/03/2022, 22:50:18] Elliot: ‎<attached: 00000561-PHOTO-2022-03-01-22-50-18.jpg>
[01/03/2022, 22:51:49] .: Ewww stop
[01/03/2022, 22:52:18] Elliot: He he
‎[01/03/2022, 22:52:21] Elliot: ‎<attached: 00000564-STICKER-2022-03-01-22-52-21.webp>
[01/03/2022, 22:56:28] .: And that who is it
‎[01/03/2022, 22:56:49] Elliot: ‎<attached: 00000566-STICKER-2022-03-01-22-56-49.webp>
‎[02/03/2022, 00:41:51] .: ‎<attached: 00000567-PHOTO-2022-03-02-00-41-51.jpg>
[02/03/2022, 07:41:56] Elliot: Omfg ha ha ha
[02/03/2022, 07:42:40] .: Who I sucked off at robs hehe
[02/03/2022, 07:50:43] Elliot: Eeeewwwww you sacked fat Tarzan off ?!
[02/03/2022, 07:50:48] Elliot: Disgusting
[02/03/2022, 07:54:42] Elliot: No dust then 🙄
[02/03/2022, 10:50:54] .: No livid
[02/03/2022, 10:51:11] Elliot: Lol
‎[02/03/2022, 11:07:25] Elliot: ‎<attached: 00000575-PHOTO-2022-03-02-11-07-25.jpg>
[02/03/2022, 11:23:15] .: Can’t afford that nowadays 😑
[02/03/2022, 11:39:29] Elliot: No don’t think we will bother this time
[02/03/2022, 13:42:39] .: I’d like too do you think they will sell out?
[02/03/2022, 13:43:05] Elliot: Definitely
[02/03/2022, 13:43:27] Elliot: Just noticed it’s for 2 days… £60 for just Saturday
[02/03/2022, 13:44:01] Elliot: Probably be too busy at the club anyway
[02/03/2022, 19:17:25] .: Yeah following my orders
[02/03/2022, 19:24:16] Elliot: Ha ha
[03/03/2022, 16:39:30] .: Did you pass that course you did?
[03/03/2022, 16:39:49] Elliot: The DPS one?
[03/03/2022, 16:39:52] Elliot: Yes babes
[03/03/2022, 16:39:54] Elliot: 👍🏻
[03/03/2022, 16:40:42] .: Ahh well there’s my DPS for my nightclub well done
[03/03/2022, 16:50:16] Elliot: Ha ha yes boss
[04/03/2022, 09:57:22] .: Mg
[04/03/2022, 09:57:29] .: Omg major problem
[04/03/2022, 09:58:34] Elliot: What now ?
[04/03/2022, 09:59:02] .: I don’t know what to wear to nuclear poisoning/ apocalypse
[04/03/2022, 09:59:08] .: What you wearing
[04/03/2022, 10:10:57] Elliot: Black
[04/03/2022, 15:15:14] .: What the fuck are you doing
[04/03/2022, 15:15:24] Elliot: Relaxing
[04/03/2022, 15:15:30] Elliot: What the fuck toy doin
[04/03/2022, 15:15:33] Elliot: NOW
‎[04/03/2022, 15:15:37] Elliot: ‎<attached: 00000600-STICKER-2022-03-04-15-15-37.webp>
[04/03/2022, 15:15:45] .: Ewwww
[04/03/2022, 15:31:43] .: Well I’m going have a pizza I think then get ready
[04/03/2022, 15:31:54] .: Clean up at bit first
[04/03/2022, 15:35:00] Elliot: Had pizza the other day… was delicious but I didn’t sleep to well afterwards
[04/03/2022, 15:43:24] .: Make you fart
[04/03/2022, 15:43:42] Elliot: Get ready for what ?
[04/03/2022, 15:43:42] .: Only going to soho just fart all over them
[04/03/2022, 15:43:49] Elliot: Oh ha ha
[04/03/2022, 15:43:51] Elliot: Yeah
‎[04/03/2022, 15:43:56] Elliot: ‎<attached: 00000610-STICKER-2022-03-04-15-43-56.webp>
[04/03/2022, 15:44:14] .: And tell them that they look like their mother had radiation poisoning when they were conceived
‎[04/03/2022, 15:44:25] Elliot: ‎<attached: 00000612-STICKER-2022-03-04-15-44-25.webp>
[04/03/2022, 15:44:35] .: Throw pints over people and leave
‎[04/03/2022, 15:44:39] Elliot: ‎<attached: 00000614-STICKER-2022-03-04-15-44-39.webp>
[04/03/2022, 15:44:46] .: James
[04/03/2022, 15:44:51] Elliot: Ha Hax
[04/03/2022, 15:44:59] .: Get out my pub
[04/03/2022, 15:45:00] Elliot: Go see her at eagle
[04/03/2022, 15:45:08] .: Omgg pat butcher
[04/03/2022, 15:45:10] Elliot: She hasn’t got time for us now babes
[04/03/2022, 15:45:15] Elliot: She very important
[04/03/2022, 15:45:19] .: How come
[04/03/2022, 15:45:23] .: Oh yeah
[04/03/2022, 15:46:04] Elliot: Go see her and check out the security and take pictures of them and I can see if they are the same ones who barred me ha ha
[04/03/2022, 15:46:19] Elliot: Ok… thanks
[04/03/2022, 15:46:31] Elliot: And if they are then I’ll never return
[04/03/2022, 15:46:45] Elliot: Just so my own dog shit disco at work he he
‎[04/03/2022, 15:46:51] Elliot: ‎<attached: 00000628-STICKER-2022-03-04-15-46-51.webp>
[04/03/2022, 15:58:55] .: If I go that way I will
[04/03/2022, 15:59:20] .: I think mark maybe behind it being permenant
‎[04/03/2022, 15:59:29] Elliot: ‎<attached: 00000631-STICKER-2022-03-04-15-59-29.webp>
[04/03/2022, 15:59:35] .: Hates your for being right wing and brevity
[04/03/2022, 15:59:38] .: Brevity
[04/03/2022, 15:59:38] Elliot: I don’t think he knows
[04/03/2022, 15:59:49] .: Yeah think he does
[04/03/2022, 15:59:54] Elliot: 🤣🤣🤣👍🏻
[04/03/2022, 16:00:04] .: Remember a status he put that night lol
[04/03/2022, 16:00:34] Elliot: No, called him the other week as a mate left his jacket and car keys at dog shit, he was very chatty and helpful
[04/03/2022, 16:00:49] Elliot: 👍🏻
[04/03/2022, 16:01:05] .: So go then
[04/03/2022, 16:01:15] Elliot: To be totally honest I’m not fussed anyway… don’t miss it anymore lol
[04/03/2022, 16:01:29] .: Yes you do
[04/03/2022, 16:01:43] Elliot: Yeah, don’t want to go to get turned away so rather know first who’s there
[04/03/2022, 16:02:06] Elliot: Na, just do my own party on a Sunday in the courtyard he he
[04/03/2022, 16:02:25] .: Yeah when it happens
[04/03/2022, 16:03:05] .: You should also get someone to promote it
[04/03/2022, 16:03:14] Elliot: Actually, going for a meeting about doing something on a Sunday next week… we can do that asap… nothing booked in on any Sunday at the moment
[04/03/2022, 16:03:28] Elliot: Yeah, all in hand babes
[04/03/2022, 16:03:33] .: Not you lol they all hate your brexit  vote
[04/03/2022, 16:03:43] Elliot: We will see
[04/03/2022, 16:03:55] .: And right wing hitler loving stance
[04/03/2022, 16:03:57] .: Lo
[04/03/2022, 16:04:04] Elliot: That’s more you girl
[04/03/2022, 16:04:12] Elliot: I’m more white power
[04/03/2022, 16:04:13] Elliot: Ha ha
[04/03/2022, 16:04:14] .: I love the news
‎[04/03/2022, 16:04:16] Elliot: ‎<attached: 00000657-STICKER-2022-03-04-16-04-16.webp>
[04/03/2022, 16:04:17] .: Yeah ok
‎[04/03/2022, 16:04:37] Elliot: ‎<attached: 00000659-PHOTO-2022-03-04-16-04-37.jpg>
[04/03/2022, 16:04:48] .: Glendora
[04/03/2022, 16:04:54] Elliot: 🤣🤣🤣🤣🤣👍🏻
[04/03/2022, 16:06:20] Elliot: Them Defective tickets aren’t going as fast as last years lol
[04/03/2022, 16:06:34] .: Omg
[04/03/2022, 16:06:43] .: Be all dead by then
[04/03/2022, 16:07:04] Elliot: Sold out in a day last year… can still get tickets for this year
[04/03/2022, 16:08:41] .: Pandemic and all the prices have gone up people can’t afford to go out as much I suppose
[04/03/2022, 16:09:21] Elliot: Yeah maybe
[04/03/2022, 20:58:07] .: Are you at work tonight.
[04/03/2022, 20:58:15] .: I’m not going soho
[04/03/2022, 20:59:55] Elliot: Yes babes
[04/03/2022, 21:02:41] .: Disgusting
‎[04/03/2022, 21:40:49] .: ‎<attached: 00000672-PHOTO-2022-03-04-21-40-49.jpg>
[04/03/2022, 21:41:11] .: Not watched that for years thatbks for telling me you and Andrew were on it
[04/03/2022, 21:52:13] Elliot: Ha ha ha
[04/03/2022, 21:52:15] Elliot: Slag
[04/03/2022, 21:52:36] .: Lol
‎[04/03/2022, 21:59:32] Elliot: ‎<attached: 00000677-STICKER-2022-03-04-21-59-32.webp>
[05/03/2022, 19:35:46] Elliot: W
[05/03/2022, 19:35:48] Elliot: N
[05/03/2022, 19:48:45] .: Nothing
[05/03/2022, 19:49:02] Elliot: Omfg
[05/03/2022, 19:49:03] Elliot: Ok
[05/03/2022, 19:49:05] Elliot: He he
[05/03/2022, 19:49:10] Elliot: How was soho
[05/03/2022, 19:49:15] Elliot: Oh you didn’t go
[05/03/2022, 19:49:21] Elliot: Dog shit ?
[05/03/2022, 19:49:51] .: Nope
[05/03/2022, 19:50:09] Elliot: Omg go now
[05/03/2022, 19:50:12] .: Stayed home
[05/03/2022, 19:50:19] Elliot: Ok ok ok ok ok ok
[05/03/2022, 19:50:21] Elliot: He he
[05/03/2022, 19:50:25] .: Think I may go my sisters
[05/03/2022, 19:50:35] Elliot: For how long ?
[05/03/2022, 19:50:45] .: Dunno
[05/03/2022, 19:50:49] Elliot: Omg
[05/03/2022, 19:50:50] .: Bored here
[05/03/2022, 19:51:04] Elliot: You need a hobby
[05/03/2022, 19:51:12] Elliot: Take up knitting
[05/03/2022, 19:51:55] Elliot: Well we can give you a job as soon as we can babes… you can spend your days doing as I tell you
[05/03/2022, 20:20:24] .: You can get fucked as well lol
[05/03/2022, 20:21:03] .: I’ve been doing my hobby today the cloud then my plan was to go see beckhem but he’s off this weekend
[05/03/2022, 20:26:10] .: What’s Julian’s posts like
[05/03/2022, 20:27:11] Elliot: Think he’s been sacked by what Sausage was saying
[05/03/2022, 20:27:24] .: Ooooo
[05/03/2022, 20:27:26] Elliot: Julian who ?
[05/03/2022, 20:28:05] Elliot: Oh ha ha….  Dry Quiet
[05/03/2022, 20:28:11] Elliot: Ooops very
[05/03/2022, 20:29:29] .: Why what’s he’s done
[05/03/2022, 20:30:59] Elliot: Well,
[05/03/2022, 20:32:15] Elliot: Apparently he demanded there be 3 security where he Works. Gary said they only pay for two, so he goes to the manager of the place and demands 3 security or he’s off, the manager said bye bye
[05/03/2022, 20:32:17] Elliot: Lol
[05/03/2022, 20:32:23] Elliot: 🤷🏼‍♂️
[05/03/2022, 20:32:47] .: Gary wil have him somewhere else then I take it
[05/03/2022, 20:32:54] .: He’s struggling as it is
‎[05/03/2022, 20:34:20] .: ‎<attached: 00000716-PHOTO-2022-03-05-20-34-20.jpg>
[05/03/2022, 20:35:26] Elliot: Dunno then… who cares, he’s a dick anyway
[05/03/2022, 20:52:23] .: He’s not
[05/03/2022, 20:52:33] Elliot: He is
[05/03/2022, 20:52:37] .: He’s a nice guy beckhem I like him
[05/03/2022, 20:52:42] .: Why’s he a dick
‎[05/03/2022, 20:52:47] Elliot: ‎<attached: 00000722-STICKER-2022-03-05-20-52-47.webp>
[05/03/2022, 20:52:49] .: What he done to you now lol
[05/03/2022, 20:53:06] Elliot: Nothing, just a dick
[05/03/2022, 20:53:27] .: Oh just Normal then
[05/03/2022, 20:54:17] Elliot: Mmm just not keen on him… you like him that’s fine
[05/03/2022, 20:55:04] .: Little bitch
‎[05/03/2022, 20:55:12] Elliot: ‎<attached: 00000728-STICKER-2022-03-05-20-55-12.webp>
[05/03/2022, 20:55:23] .: U working
[05/03/2022, 20:55:25] Elliot: Think I might go out tonight he he
[05/03/2022, 20:55:37] .: Ok bye
[05/03/2022, 20:55:42] Elliot: Help me be rancid in all the fucking meetings next week ha ha
[05/03/2022, 20:56:04] .: Little bench
[05/03/2022, 20:57:40] Elliot: He he
[05/03/2022, 20:58:01] Elliot: Got drugs last night, shame not to use ‘em
[05/03/2022, 20:58:04] Elliot: He he
[05/03/2022, 20:58:23] .: So your all ready going out
[05/03/2022, 20:58:58] Elliot: Na, just thinking about it
[05/03/2022, 20:59:08] .: Lies will be alll planned
[05/03/2022, 20:59:13] .: Little cow
[05/03/2022, 20:59:30] Elliot: 😵‍💫😵‍💫😵‍💫
[05/03/2022, 22:18:27] .: So u gone out
[05/03/2022, 22:18:30] .: Bitch
[05/03/2022, 22:24:17] Elliot: No
[05/03/2022, 22:37:32] .: Why
[05/03/2022, 22:37:55] .: You should calm down alll the epic Saturday nights in
[05/03/2022, 22:37:59] .: Disgusting
[05/03/2022, 22:38:52] Elliot: Too early
‎[05/03/2022, 22:39:03] Elliot: ‎<attached: 00000749-PHOTO-2022-03-05-22-39-03.jpg>
[05/03/2022, 22:39:50] .: U need to improve
[05/03/2022, 22:42:31] Elliot: Egg babes… nothing but 5 stars for Electrokerkz
[06/03/2022, 13:07:47] .: So what did you do
[06/03/2022, 14:23:08] .: NOW
[06/03/2022, 14:23:40] Elliot: Shopping
[06/03/2022, 19:47:36] .: Horse meat?
[06/03/2022, 19:47:41] .: Hehe
[06/03/2022, 19:48:00] Elliot: Yeah find out who security are
[06/03/2022, 19:48:03] Elliot: NOW
[06/03/2022, 19:48:11] .: No as a collective
[06/03/2022, 19:48:32] Elliot: errrr…. I’m not going down there to be turned away
[06/03/2022, 19:48:34] Elliot: Babes
[06/03/2022, 19:48:36] .: Lol
[06/03/2022, 19:48:40] Elliot: I need to know who it is
[06/03/2022, 19:48:45] Elliot: Or I’m not going
[06/03/2022, 19:48:46] Elliot: He he
‎[06/03/2022, 19:48:49] Elliot: ‎<attached: 00000766-STICKER-2022-03-06-19-48-49.webp>
[06/03/2022, 19:48:59] .: That’s happened once it will be fine
[06/03/2022, 19:49:12] .: Take it on the chin
‎[06/03/2022, 19:49:13] Elliot: ‎<attached: 00000769-STICKER-2022-03-06-19-49-13.webp>
[06/03/2022, 19:49:27] Elliot: I have that’s why I’ve stayed away
[06/03/2022, 19:49:33] Elliot: 2 years
[06/03/2022, 19:49:39] .: No try and try again
[06/03/2022, 19:49:48] Elliot: yeah.. ok
‎[06/03/2022, 19:50:02] Elliot: ‎<attached: 00000774-STICKER-2022-03-06-19-50-02.webp>
[06/03/2022, 19:50:24] .: You some your not that important knocking into you ecverryso often it help
[06/03/2022, 19:51:11] Elliot: In English pleas
[06/03/2022, 19:51:14] Elliot: e
[06/03/2022, 19:51:46] .: You need some “ you’re not that important” knocking into you
[06/03/2022, 19:51:56] Elliot: Ha ha
[06/03/2022, 19:52:07] .: Go get refused
[06/03/2022, 19:52:14] .: Bring you back to earth
[06/03/2022, 19:52:20] Elliot: 🙄 I don’t think so babes
[06/03/2022, 19:52:26] .: Yes Barbara
[06/03/2022, 19:52:27] Elliot: I’m Elliot Hayward
[06/03/2022, 19:52:31] .: Err babes
‎[06/03/2022, 19:52:38] Elliot: ‎<attached: 00000786-STICKER-2022-03-06-19-52-38.webp>
‎[06/03/2022, 19:52:49] Elliot: ‎<attached: 00000787-STICKER-2022-03-06-19-52-49.webp>
[07/03/2022, 18:09:19] Elliot: W
[07/03/2022, 18:09:21] Elliot: T
[07/03/2022, 18:09:23] Elliot: F
[07/03/2022, 18:09:32] Elliot: NOW
[07/03/2022, 18:09:50] .: Thought I was being invaded by the Russians
‎[07/03/2022, 18:09:56] .: ‎<attached: 00000793-PHOTO-2022-03-07-18-09-56.jpg>
‎[07/03/2022, 18:09:59] Elliot: ‎<attached: 00000794-PHOTO-2022-03-07-18-09-59.jpg>
[07/03/2022, 18:10:14] Elliot: Omfg
[07/03/2022, 18:10:25] Elliot: You got fed up with it ?
[07/03/2022, 18:10:38] .: No it came from the roof
[07/03/2022, 18:10:46] Elliot: 🤣🤣🤣🤣🤣🤣🤣🤣🤣🤣
‎[07/03/2022, 18:11:03] Elliot: ‎<attached: 00000799-PHOTO-2022-03-07-18-11-03.jpg>
[07/03/2022, 18:11:12] .: The fuck is that
[07/03/2022, 18:11:49] Elliot: A large penis
[07/03/2022, 18:12:13] .: Why you taking pics of yourself constantly
[07/03/2022, 18:12:31] Elliot: Reminded me of YOU
[07/03/2022, 18:16:55] .: Which is a beautiful penis so ok
[07/03/2022, 18:17:04] Elliot: 🤮🤮🤮
‎[07/03/2022, 18:17:13] Elliot: ‎<attached: 00000806-STICKER-2022-03-07-18-17-13.webp>
[07/03/2022, 18:18:42] .: Wtf
[07/03/2022, 18:18:44] .: Have
[07/03/2022, 18:18:48] .: You…
[07/03/2022, 18:19:02] Elliot: Been working babes
[07/03/2022, 18:19:09] Elliot: And. Having meetings
[07/03/2022, 18:19:35] .: Do anything ever come of these meetings
[07/03/2022, 18:20:02] Elliot: Yes babes
[07/03/2022, 18:20:14] Elliot: A fucking headache
[07/03/2022, 18:20:16] Elliot: Lol
[07/03/2022, 18:20:29] .: Lol
[07/03/2022, 18:20:50] .: Then another meeting is then needdd
[07/03/2022, 18:21:05] Elliot: This one was with Gareth 😵‍💫😵‍💫😵‍💫
[07/03/2022, 18:24:05] .: So this will be your pen and this will be mine
[07/03/2022, 18:24:06] Elliot: Everyone needs to understand why your in charge babes
[07/03/2022, 18:24:16] .: Oh nice lol
‎[07/03/2022, 18:24:17] Elliot: ‎<attached: 00000822-STICKER-2022-03-07-18-24-17.webp>
‎[07/03/2022, 18:24:28] Elliot: ‎<attached: 00000823-STICKER-2022-03-07-18-24-28.webp>
[07/03/2022, 18:58:26] .: Wtf have you been doing since calling me a slag at 18.24
[07/03/2022, 18:58:49] Elliot: Working
[07/03/2022, 18:58:52] .: Omfg
[07/03/2022, 18:58:55] .: Doing what
[07/03/2022, 18:59:02] Elliot: Stock
[07/03/2022, 20:25:31] .: What’s them flavoured tea bags you can get what aren’t tea flavour if you get me
[07/03/2022, 20:26:04] Elliot: Omfg what the hell does that mean ?
[07/03/2022, 20:26:11] Elliot: I’m off this weekend he he
[07/03/2022, 20:26:34] .: They are tea bags and are tea but not like normal tea
[07/03/2022, 20:26:47] .: Twinnings do them
[07/03/2022, 20:26:52] Elliot: Pass
‎[07/03/2022, 20:27:03] Elliot: ‎<attached: 00000835-STICKER-2022-03-07-20-27-03.webp>
[07/03/2022, 20:27:11] Elliot: Hall bag tea
[07/03/2022, 20:27:11] .: Useless
‎[07/03/2022, 20:27:25] Elliot: ‎<attached: 00000838-PHOTO-2022-03-07-20-27-25.jpg>
[07/03/2022, 20:27:30] .: No the called tea
[07/03/2022, 20:42:39] Elliot: Coffee bag
[07/03/2022, 20:42:50] Elliot: Big bag
[07/03/2022, 20:42:57] Elliot: Carry bag
[07/03/2022, 20:43:09] Elliot: Silly old bag
[07/03/2022, 20:43:14] Elliot: Dunno babes
[07/03/2022, 20:43:29] .: Like a country house name thing
[07/03/2022, 20:44:05] Elliot: Downton Bag
[07/03/2022, 20:44:27] .: Nooo
[07/03/2022, 20:44:29] Elliot: Checkers bag
[07/03/2022, 20:44:44] .: Earl grey that’s it
[07/03/2022, 20:44:50] Elliot: Omg
[07/03/2022, 20:44:53] Elliot: Ha ha ha
[07/03/2022, 20:44:57] Elliot: It’s not nice
[07/03/2022, 20:44:59] .: Ming
[07/03/2022, 20:45:08] .: I like It
[07/03/2022, 20:45:27] Elliot: You need to go to fortnum and mason they got loads of teas
[07/03/2022, 20:45:44] .: Queen drinks that
[07/03/2022, 20:45:57] Elliot: She had builders tea
[08/03/2022, 14:18:58] .: W……….
‎[08/03/2022, 14:19:25] Elliot: ‎<attached: 00000859-PHOTO-2022-03-08-14-19-25.jpg>
[08/03/2022, 14:19:59] .: Drinking piss buying material things
[08/03/2022, 14:20:02] .: Nice
‎[08/03/2022, 14:20:45] Elliot: ‎<attached: 00000862-PHOTO-2022-03-08-14-20-45.jpg>
[08/03/2022, 14:21:01] .: Dressing like a beefeater
‎[08/03/2022, 14:28:35] Elliot: ‎<attached: 00000864-PHOTO-2022-03-08-14-28-35.jpg>
‎[08/03/2022, 14:33:29] .: ‎<attached: 00000865-PHOTO-2022-03-08-14-33-29.jpg>
[08/03/2022, 14:34:17] Elliot: Ha ha
‎[08/03/2022, 16:26:45] .: ‎<attached: 00000867-PHOTO-2022-03-08-16-26-45.jpg>
[08/03/2022, 16:34:26] Elliot: Aaaahhhh ha ha
[08/03/2022, 20:59:51] .: Finished playing Bunkers
[08/03/2022, 21:00:03] .: Wtf NOW
[08/03/2022, 21:00:36] Elliot: Bunkers ?
[08/03/2022, 21:01:16] .: Yeah you lay on sofa cover yourself with the cushions and pretend your in a Ukrainian bunker
[08/03/2022, 21:01:27] Elliot: Omg
[08/03/2022, 21:01:31] .: And fall asleep
[08/03/2022, 21:01:37] Elliot: How long did you do that for ?
[08/03/2022, 21:01:50] .: Welll 5 hour ish
[08/03/2022, 21:01:54] Elliot: Lol
[08/03/2022, 21:02:02] Elliot: Think you should go back to doing it
[08/03/2022, 21:02:07] .: No
[08/03/2022, 21:02:09] Elliot: For a WEEK
[08/03/2022, 21:02:12] .: NOW
‎[08/03/2022, 21:02:34] Elliot: ‎<attached: 00000882-STICKER-2022-03-08-21-02-34.webp>
[08/03/2022, 21:02:55] .: What you doing
[08/03/2022, 21:03:08] .: Do you want to meet this week at some point
[08/03/2022, 21:03:43] Elliot: Chilling at home now… Thursday we are free I think
[08/03/2022, 21:04:12] Elliot: But I’ve got to see Curtis at 7pm
[08/03/2022, 21:04:32] Elliot: Go over the logistics of House of Trash on the 19th
[08/03/2022, 21:04:44] Elliot: Meeting in soho
[08/03/2022, 21:04:45] .: Going to zoflora my sofa cushion covers
[08/03/2022, 21:04:55] .: 😴
[08/03/2022, 21:05:00] Elliot: What flavor
[08/03/2022, 21:05:27] .: You ever tried raspberry and juniper berry
[08/03/2022, 21:05:34] Elliot: You not coming to it then?
[08/03/2022, 21:05:42] Elliot: Eeewww no
[08/03/2022, 21:05:44] .: That or linen fresh
[08/03/2022, 21:05:49] .: It’s nice
[08/03/2022, 21:05:56] Elliot: We are on Christmas tree one at the mo
[08/03/2022, 21:06:13] .: Well not been invited but that’s not the reason a meeting about logistics lol
[08/03/2022, 21:06:26] .: Just open the doors and it will be a drug mess like the rest
[08/03/2022, 21:06:31] .: Lol
[08/03/2022, 21:07:04] .: Spiced plum was nice
[08/03/2022, 21:07:13] Elliot: Well, it’s not as simple as that..
[08/03/2022, 21:07:23] .: Yes it is lol
[08/03/2022, 21:07:32] .: Who cares lol
[08/03/2022, 21:07:39] Elliot: No because I’ve got 2 other events on b4 them
[08/03/2022, 21:07:51] .: Let them over run lol
[08/03/2022, 21:08:01] Elliot: Can’t remember the best smelling one…
[08/03/2022, 21:08:20] .: I’m gunna buy 5 litre one I think
[08/03/2022, 21:08:28] .: Or 500ml even
[08/03/2022, 21:08:34] Elliot: Midnight bloom is my fav
[08/03/2022, 21:08:49] .: Not 5 litre
[08/03/2022, 21:08:57] Elliot: Ha ha it’s not G babes
[08/03/2022, 21:09:00] .: I like that one think I just finished it
[08/03/2022, 21:09:06] .: Omg G
[08/03/2022, 21:09:13] Elliot: 👍🏻👍🏻👍🏻
[08/03/2022, 21:09:14] .: Not had that for agessss
[08/03/2022, 21:09:19] Elliot: Get me some NOW
[08/03/2022, 21:09:28] .: Pgffff
[08/03/2022, 21:09:37] .: He was the only guy I knew
[08/03/2022, 21:09:47] Elliot: Slag
[08/03/2022, 21:09:54] Elliot: I got some anyway
[08/03/2022, 21:10:05] Elliot: Need meth
[08/03/2022, 21:10:07] Elliot: NOW
[08/03/2022, 21:10:12] .: Curtis
[08/03/2022, 21:10:24] .: He’s a drug dealer
[08/03/2022, 21:10:26] Elliot: Yeah he’s bringing some on Thursday
[08/03/2022, 21:10:31] .: As him
[08/03/2022, 21:10:32] Elliot: Already paid for it ha ha
[08/03/2022, 21:10:35] .: Seee
[08/03/2022, 21:10:41] .: Why you need that
[08/03/2022, 21:10:54] Elliot: 2 birds with one stone as it were babes
[08/03/2022, 21:10:55] .: Where the guck are you Going
[08/03/2022, 21:11:07] Elliot: Might go out on Saturday
[08/03/2022, 21:11:13] Elliot: I’m off all weekend
[08/03/2022, 21:11:15] .: Where
[08/03/2022, 21:11:21] Elliot: Might go out on Friday to
[08/03/2022, 21:11:33] Elliot: Feel it Friday
[08/03/2022, 21:11:56] Elliot: need to go to these places get som info on what they doing
‎[08/03/2022, 21:12:29] Elliot: ‎<attached: 00000939-PHOTO-2022-03-08-21-12-29.jpg>
[08/03/2022, 21:13:26] .: Who the fuck is that
[08/03/2022, 21:13:36] .: Or what is it
[08/03/2022, 21:13:43] Elliot: Some new bar we discovered in KX
[08/03/2022, 21:13:51] Elliot: it’s camp… cocktails
[08/03/2022, 21:14:37] Elliot: Got to raid the drug box to…
[08/03/2022, 21:14:44] Elliot: Little legs wants cock
[08/03/2022, 21:14:49] Elliot: Oops coke ha ha ha
[08/03/2022, 21:14:54] .: Omg
[08/03/2022, 21:15:04] .: Where’s the posh drug dealer gone
[08/03/2022, 21:15:49] Elliot: He doesn’t want to pay babes 🙄
[08/03/2022, 21:16:42] .: Offs
‎[08/03/2022, 21:30:37] Elliot: ‎<attached: 00000951-STICKER-2022-03-08-21-30-37.webp>
‎[08/03/2022, 21:30:53] Elliot: ‎<attached: 00000952-STICKER-2022-03-08-21-30-53.webp>
[09/03/2022, 13:48:04] .: Camp
[09/03/2022, 13:48:50] Elliot: He he
[09/03/2022, 13:52:31] Elliot: What the fuck
[09/03/2022, 13:52:36] Elliot: Are you doing
[09/03/2022, 13:52:38] Elliot: NOW
[09/03/2022, 13:53:00] .: Zofloring
[09/03/2022, 13:53:24] .: Inginng
[09/03/2022, 13:53:26] Elliot: Omg
‎[09/03/2022, 13:53:50] Elliot: ‎<attached: 00000961-PHOTO-2022-03-09-13-53-50.jpg>
[09/03/2022, 13:53:52] .: Wtf….
‎[09/03/2022, 13:54:21] Elliot: ‎<attached: 00000963-PHOTO-2022-03-09-13-54-21.jpg>
[09/03/2022, 13:57:27] .: Don’t like that name
[09/03/2022, 13:57:42] .: Brussels sprout
[09/03/2022, 13:57:49] Elliot: It’s camp and smells divine
[09/03/2022, 13:57:54] Elliot: Like my bum hole
[09/03/2022, 13:57:56] .: Sprouce sprout
[09/03/2022, 13:58:17] .: Digezten
‎[09/03/2022, 13:59:01] Elliot: ‎<attached: 00000970-STICKER-2022-03-09-13-59-01.webp>
‎[09/03/2022, 13:59:02] Elliot: ‎<attached: 00000971-STICKER-2022-03-09-13-59-02.webp>
[09/03/2022, 13:59:31] .: Bet his finger stings
[09/03/2022, 14:38:24] .: 3 years ago you would be banging on about aftershave fragrance now it’s zoflora smells what happened
[09/03/2022, 14:39:10] Elliot: I got all the aftershave I wanted
‎[09/03/2022, 14:39:13] Elliot: ‎<attached: 00000975-STICKER-2022-03-09-14-39-13.webp>
[09/03/2022, 14:39:37] .: I say this as look upon a bag of white powder i found
[09/03/2022, 14:40:00] .: And as I think of a little afternoon session whilst zofloraring
[09/03/2022, 14:40:02] .: Lol
[09/03/2022, 14:40:29] Elliot: Omg
[09/03/2022, 14:40:36] Elliot: Save it until we go out babes
[09/03/2022, 14:40:57] .: Errrr I don’t even know what the fuck it’s is
[09/03/2022, 14:41:10] .: Some poison you testing on me
[09/03/2022, 14:41:12] Elliot: Omfg
[09/03/2022, 14:41:24] Elliot: Yeah we always tested stuff on you ha ha ha
[09/03/2022, 14:41:30] .: Bam on the floor 14
41
‎[09/03/2022, 15:25:02] .: ‎<attached: 00000986-PHOTO-2022-03-09-15-25-02.jpg>
[09/03/2022, 15:25:31] Elliot: Lol
[09/03/2022, 15:25:48] Elliot: Do it then you could become manager at egale
[09/03/2022, 15:26:56] .: Noooo
[09/03/2022, 15:28:05] Elliot: Yes 👏🏻
[09/03/2022, 15:28:09] Elliot: Yes
[09/03/2022, 15:28:13] Elliot: Yes
[09/03/2022, 15:37:54] .: It’s put me in the mood for ice cream
[09/03/2022, 15:38:44] Elliot: Go shop buy some and bring it to the club
[09/03/2022, 15:38:46] Elliot: NOW
[09/03/2022, 15:39:02] .: Just deciding what flavour
[09/03/2022, 15:39:25] Elliot: Banana
[09/03/2022, 15:39:30] .: Ewwwww
[09/03/2022, 15:39:33] Elliot: now
[09/03/2022, 15:39:35] .: No
[09/03/2022, 15:39:55] Elliot: BARRED
[09/03/2022, 15:40:01] .: Pfffft
[09/03/2022, 18:22:15] .: My security says different
[09/03/2022, 18:22:27] .: Hey Katie working at the club lol
[09/03/2022, 18:22:43] .: Wtf are you doing
[09/03/2022, 18:22:48] .: NOW
[09/03/2022, 19:21:08] .: NOW
[09/03/2022, 19:21:17] .: 1 hour late
[09/03/2022, 20:34:52] Elliot: Ha ha very important 
Meeeting
[09/03/2022, 20:36:21] .: What about you and Curtis wearing matching outfits on his party or something
[09/03/2022, 20:36:34] .: Load of shite
[09/03/2022, 20:36:58] Elliot: Errr no….
[09/03/2022, 20:37:04] Elliot: Another party…
‎[09/03/2022, 20:37:06] .: ‎<attached: 00001014-PHOTO-2022-03-09-20-37-05.jpg>
[09/03/2022, 20:37:13] .: Over
[09/03/2022, 20:37:29] .: Just me on my own
[09/03/2022, 20:37:43] Elliot: Omg you bitch
[09/03/2022, 20:37:57] Elliot: Can’t say what party but it’s BIG he he
[09/03/2022, 20:38:07] .: Oh here we go
[09/03/2022, 20:38:40] .: Like I have ever said anything
[09/03/2022, 20:38:49] .: Bet everyone else will know
[09/03/2022, 20:38:54] .: But whatever
[09/03/2022, 20:39:08] Elliot: Ok
[09/03/2022, 20:45:05] Elliot: If I tell you you have to promise not to say a word
[09/03/2022, 20:45:24] .: I’m going to tell every single sole I meet
‎[09/03/2022, 20:47:00] .: ‎<attached: 00001026-GIF-2022-03-09-20-47-00.mp4>
[09/03/2022, 20:47:09] Elliot: Ok fine I can’t tell you then
[09/03/2022, 20:47:34] .: Go on….
[09/03/2022, 20:47:49] .: I don’t meet anyone
[09/03/2022, 20:47:51] .: Hehe
[09/03/2022, 20:48:01] Elliot: It’s top secret
[09/03/2022, 20:48:19] Elliot: You will get drunk and tell
[09/03/2022, 20:48:27] .: I won’t don’t drink
[09/03/2022, 20:49:28] .: Xxl
[09/03/2022, 20:49:32] .: Beyond
[09/03/2022, 20:49:34] .: Mos
[09/03/2022, 20:49:41] .: We
[09/03/2022, 20:59:24] Elliot: BEEFMINCE
‎[09/03/2022, 20:59:50] .: ‎<attached: 00001039-GIF-2022-03-09-20-59-49.mp4>
[09/03/2022, 21:00:09] Elliot: 😵‍💫😵‍💫
[09/03/2022, 21:00:14] .: I’m ecstatic
[09/03/2022, 21:00:21] .: Hahaha
[09/03/2022, 21:00:37] Elliot: Ha ha all very hush hush
[09/03/2022, 21:00:46] Elliot: So keep it to yourself
[09/03/2022, 21:00:47] .: I can’t contain my self here
[09/03/2022, 21:00:49] Elliot: Please
[09/03/2022, 21:00:54] .: Il try my hardest
[09/03/2022, 21:01:00] .: I really will
[09/03/2022, 21:01:01] .: Lol
[09/03/2022, 21:01:33] .: No of course I’ve never said anything before and won’t now
[09/03/2022, 21:02:30] Elliot: 👏🏻👏🏻
[09/03/2022, 21:04:12] Elliot: He wants to stay at RVT just wants to see a “one off” big party see how it goes etc
[09/03/2022, 21:11:25] .: They all lefty brexit hating labour lot you best stay in the office lol
[09/03/2022, 21:17:48] Elliot: I’ll get someone else to manage it ha ha
[09/03/2022, 21:17:58] Elliot: Going to go on 1st April
[09/03/2022, 21:24:38] Elliot: You seen that new after hours club ?
[09/03/2022, 21:24:46] Elliot: Wiled boys
[09/03/2022, 21:25:01] .: Where’s that
[09/03/2022, 21:25:07] Elliot: Union
[09/03/2022, 21:25:11] .: Nah
[09/03/2022, 21:25:35] .: What’s that about
[09/03/2022, 21:26:39] Elliot: Steve sharp and Pigano
[09/03/2022, 21:26:51] Elliot: Going to have a darkroom
[09/03/2022, 21:27:06] Elliot: It’s not really after hours… 10-6
[09/03/2022, 21:27:10] .: Won’t last
[09/03/2022, 21:27:10] Elliot: 🤔
[09/03/2022, 21:27:19] Elliot: No I don’t think it will either
[09/03/2022, 21:27:44] Elliot: Up against union and Trough
[09/03/2022, 21:28:04] Elliot: Oops unicorn ha ha
[09/03/2022, 21:28:17] .: And electroworx soon
[09/03/2022, 21:33:00] Elliot: He he shhhhh
[09/03/2022, 21:34:47] .: I want a name change
[09/03/2022, 21:34:50] .: Too
[09/03/2022, 21:35:01] .: Or the way it’s spelled
[09/03/2022, 21:35:11] Elliot: Like ?
[09/03/2022, 21:35:24] .: Electroworx
[09/03/2022, 21:35:32] .: An x is better
[09/03/2022, 21:35:44] .: Electrowerx
[09/03/2022, 21:35:54] .: Electroworxs
[09/03/2022, 21:35:55] Elliot: 🤔🤔
[09/03/2022, 22:04:01] Elliot: https://www.instagram.com/tv/Ca5NyLDAJl2/?utm_medium=share_sheet
[09/03/2022, 22:04:30] .: Looks wank
[09/03/2022, 22:04:43] Elliot: Ha ha
[09/03/2022, 22:04:48] Elliot: Sold out
[09/03/2022, 22:04:56] Elliot: In 2 hours
[09/03/2022, 22:06:20] .: Did that drag queen they friends with promote it
[09/03/2022, 22:06:39] .: Or share it they lol djs not hard to sell out
[09/03/2022, 22:06:46] .: Most places do
[09/03/2022, 22:07:56] Elliot: Nope
[09/03/2022, 22:08:23] .: None of the djs promotes it?
[09/03/2022, 22:08:50] Elliot: First ever party never heard of b4… it’s impressive he managed to sell out
[09/03/2022, 22:09:04] Elliot: They have only just announced them
[09/03/2022, 22:09:27] .: Yeah but they clearly knew who would be playing
[09/03/2022, 22:09:49] Elliot: 1959 views of that video I sent on Insta
[09/03/2022, 22:10:09] .: So it’s just all them plus also I noticed loads of new party’s all clubs have been closed it’s bound to take off
[09/03/2022, 22:10:13] .: Good luck to them
[09/03/2022, 22:10:16] Elliot: At the time they sold tickets.. it was just Curtis Djing
[09/03/2022, 22:11:22] .: How it’s does well takes off and is a winner lol
[09/03/2022, 22:12:18] Elliot: Hopefully… will be good for the club
[09/03/2022, 22:12:38] .: Yeah all you’ll all be one big happy family
[09/03/2022, 22:12:53] .: House of trash family
[09/03/2022, 22:13:43] Elliot: Yeah Trash
[09/03/2022, 22:13:54] Elliot: So your not coming to this party either then ?
[09/03/2022, 22:14:58] .: Well to say we are supposed to be friends and be not been invited by Curtis and still seems to be an atmosphere for some reason so I dunno
[09/03/2022, 22:15:32] Elliot: Omg…. What you done now ?!
[09/03/2022, 22:15:42] .: It’s like somethings been said or happened between us what I don’t know about
[09/03/2022, 22:15:50] Elliot: Your on my guest list anyway
[09/03/2022, 22:15:50] .: Hmmmmm I wonder
[09/03/2022, 22:16:03] .: Who cares
[09/03/2022, 22:16:30] Elliot: Dunno… they are all in the gay gays life’s now..  we hardly ever seen them now
[09/03/2022, 22:16:53] .: Can’t be arsed with the immaturity of it to be honest
[09/03/2022, 22:17:19] .: Did he tell you about him being diagnosed with ADHD
[09/03/2022, 22:18:05] Elliot: Yeah…. Leanne told us
[09/03/2022, 22:18:17] Elliot: Explains everything lol
[09/03/2022, 22:19:38] .: When is the party
[09/03/2022, 22:19:53] Elliot: Next Saturday… 19th
[09/03/2022, 22:20:05] .: Sorry Chas and Dave tribute act is on at the local
[09/03/2022, 22:20:10] Elliot: Lol ok
[09/03/2022, 22:20:30] .: Put Gio on it lol
[09/03/2022, 22:20:39] Elliot: Who’s he ?
[09/03/2022, 22:20:44] .: Offffttt
[09/03/2022, 22:20:52] Elliot: Haven’t spoken with him for months lol
[09/03/2022, 22:21:17] .: He’s got his new temp friends
[09/03/2022, 22:22:08] .: They will leave and he will come back messaging it’s happens. I Stay loyal and then know where I stand
[09/03/2022, 22:23:25] Elliot: Yeah… everyone moves on with their lives babes..
[09/03/2022, 22:24:08] .: Hmmm and just throw friends ships away good luck to them
[12/03/2022, 14:17:47] .: Went to soho Thursday got really drunk think I told someone about beef mince opppss sorry
[12/03/2022, 14:18:23] .: Never drinking ever ever again
[12/03/2022, 14:18:27] Elliot: LIES
[12/03/2022, 14:18:52] .: Been dying for 2 days
[12/03/2022, 14:19:00] Elliot: good
[12/03/2022, 14:19:10] Elliot: not tell you anything ever again
‎[12/03/2022, 14:19:21] Elliot: ‎<attached: 00001133-STICKER-2022-03-12-14-19-21.webp>
[12/03/2022, 14:19:30] .: Me and my big mouth
[12/03/2022, 14:20:40] .: May not have thought may have just been about the club
‎[12/03/2022, 14:21:48] Elliot: ‎<attached: 00001136-PHOTO-2022-03-12-14-21-48.jpg>
[12/03/2022, 14:21:57] .: Omg
[12/03/2022, 14:22:11] .: Did you hear about tiger tiger
[12/03/2022, 14:22:40] Elliot: Tell me
[12/03/2022, 14:22:46] Elliot: NOW
[12/03/2022, 14:23:34] .: Fucking bar staff gave customers caustic soda to lick instead of salt with taqulia
[12/03/2022, 14:24:01] .: All frothing and bleeding from the mouth n nose
[12/03/2022, 14:24:08] Elliot: 🤣🤣🤣🤣🤣🤣🤣🤣
[12/03/2022, 14:24:15] .: Though it was a terrioist attack
[12/03/2022, 14:24:19] Elliot: Sounds like my bar staff
[12/03/2022, 14:24:22] .: Closed it all down
[12/03/2022, 14:24:26] Elliot: Ha ha ha ha
[12/03/2022, 14:24:27] Elliot: Omg
[12/03/2022, 14:24:34] Elliot: When was this ?
[12/03/2022, 14:27:30] .: Errr few week ago or may have been when everything opened can’t remember
[12/03/2022, 14:27:50] .: Was paying attention to some sexy guy
[12/03/2022, 14:30:20] Elliot: Omg your useless
[12/03/2022, 14:30:38] Elliot: Why didn’t you go and annoy James at Eagle
[12/03/2022, 14:31:21] .: Because I was being showered with attention and free beer lol why the fuck would I go there
[12/03/2022, 14:31:37] .: Well the free beer
[12/03/2022, 14:32:00] .: I could have had it but paid em then got shouted at for paying lol
[12/03/2022, 14:32:18] Elliot: Paying who ?
[12/03/2022, 14:33:31] .: For the drink at circa Adam who works behind the bar was like I will get your drink so went to the bar then someone Else server me and I paid thes like I told you to wait
[12/03/2022, 14:33:36] .: Happened twice
[12/03/2022, 14:33:52] Elliot: Omg ha ha
[12/03/2022, 14:34:10] .: Anyway I wouldn’t go to the Eagle
[12/03/2022, 14:34:19] .: Not week day
[12/03/2022, 14:36:03] .: First proper night out drinking in 3 years never again
[12/03/2022, 14:37:15] Elliot: Lol
[12/03/2022, 14:37:22] Elliot: Good I’m glad your suffering
[12/03/2022, 14:38:09] .: Loool
‎[12/03/2022, 14:38:30] Elliot: ‎<attached: 00001167-STICKER-2022-03-12-14-38-30.webp>
[12/03/2022, 14:39:05] .: That your meeting with Curtis lol
[12/03/2022, 14:39:26] .: Give me drugs
[12/03/2022, 14:39:28] .: Lol
[12/03/2022, 14:39:34] Elliot: Ha ha no it was very productive actually
[12/03/2022, 14:39:51] Elliot: And yes we got 2 bags off him ha ha
[12/03/2022, 14:39:59] .: Disgusting
[12/03/2022, 14:40:46] Elliot: Were really nice he he oops
[12/03/2022, 14:40:58] .: What!
[12/03/2022, 14:41:14] Elliot: Nothing lol
[12/03/2022, 14:41:28] .: Ok weirdo
‎[12/03/2022, 14:42:23] Elliot: ‎<attached: 00001178-STICKER-2022-03-12-14-42-23.webp>
[12/03/2022, 14:42:49] .: Had some other gossip but I can’t remember it
‎[12/03/2022, 14:43:03] Elliot: ‎<attached: 00001180-STICKER-2022-03-12-14-43-03.webp>
[12/03/2022, 14:43:34] .: I’m not gunna hang my self so stop trying to get me too
‎[12/03/2022, 14:43:50] Elliot: ‎<attached: 00001182-STICKER-2022-03-12-14-43-50.webp>
[12/03/2022, 14:43:55] Elliot: Fuck yourself
[12/03/2022, 14:44:28] .: No can get someone else
[12/03/2022, 14:53:40] Elliot: Eeeeewwwww
[12/03/2022, 15:11:22] .: Wtf are you doing NOW
[12/03/2022, 15:11:41] Elliot: Relaxing…
[12/03/2022, 15:11:43] Elliot: Need to
[12/03/2022, 15:11:46] Elliot: Been busy
[12/03/2022, 15:11:47] .: Why
[12/03/2022, 15:11:48] Elliot: He he
[12/03/2022, 15:11:53] .: What you been doing
[12/03/2022, 15:12:00] Elliot: Nothing
[12/03/2022, 15:12:16] .: So what you been doing
[12/03/2022, 15:12:39] Elliot: Working babes
[12/03/2022, 15:12:42] Elliot: Always working
[12/03/2022, 15:12:54] Elliot: Oh and might have gone out last night he he
[12/03/2022, 15:13:05] .: You went out then
‎[12/03/2022, 15:13:06] Elliot: ‎<attached: 00001199-PHOTO-2022-03-12-15-13-06.jpg>
[12/03/2022, 15:13:15] .: Sex party
[12/03/2022, 15:13:40] Elliot: For research purposes
[12/03/2022, 15:13:42] .: Was you getting wiped
[12/03/2022, 15:13:52] .: Wipped
[12/03/2022, 15:13:57] Elliot: No babes
[12/03/2022, 15:14:03] .: LIEs
[12/03/2022, 15:14:07] Elliot: Ha ha
‎[12/03/2022, 15:14:20] .: ‎<attached: 00001207-PHOTO-2022-03-12-15-14-20.jpg>
[12/03/2022, 15:14:32] Elliot: He he
[12/03/2022, 23:10:26] .: Bad news
[12/03/2022, 23:11:19] .: Well for you
[12/03/2022, 23:26:44] Elliot: Go one
[12/03/2022, 23:26:48] Elliot: Oops on
[12/03/2022, 23:26:50] Elliot: He he
[12/03/2022, 23:27:09] .: I’m in eagle
[12/03/2022, 23:27:17] .: He still works here
[12/03/2022, 23:27:33] Elliot: Oh ha ha ha
[12/03/2022, 23:27:58] Elliot: Good, going to set our own Sunday party up 💪🏻💪🏻💪🏻
[12/03/2022, 23:28:14] .: I told James you found them on the floor
[12/03/2022, 23:28:15] .: Lol
[12/03/2022, 23:28:24] Elliot: Lol omg
[12/03/2022, 23:28:35] Elliot: She’s will believe that
[12/03/2022, 23:28:42] .: She has
[12/03/2022, 23:28:52] .: She said she can get him to let you in
[12/03/2022, 23:28:59] .: I said errrr don’t lol
[12/03/2022, 23:29:01] .: Hahaha
[12/03/2022, 23:37:08] Elliot: Lol yeah don’t bother….
[12/03/2022, 23:37:22] Elliot: You going to fire ?
[12/03/2022, 23:37:39] Elliot: Heat is on…. New management and security
[12/03/2022, 23:37:46] .: No lol
[12/03/2022, 23:37:50] Elliot: Oops errr apparently
[12/03/2022, 23:38:28] .: I’m going home only came to see a man about a dog in Vauxhall and called here on the way home
[12/03/2022, 23:38:51] Elliot: Well done, for looking out for me 🤗😘😘
[12/03/2022, 23:39:12] .: Hmmm someone had too
[12/03/2022, 23:39:22] Elliot: Yeah…. YOU
[12/03/2022, 23:39:34] Elliot: because you love me 🤗
[12/03/2022, 23:39:45] .: From now on I can only look out for me
[12/03/2022, 23:40:01] Elliot: Omg so selfish
[12/03/2022, 23:40:25] .: BeciEe I’m about to get pickpocketed and headbut him
[12/03/2022, 23:40:30] .: Heh
[12/03/2022, 23:40:39] .: Barred
[12/03/2022, 23:40:41] Elliot: He he
[12/03/2022, 23:40:44] Elliot: Do it
[12/03/2022, 23:40:46] Elliot: NOW
[12/03/2022, 23:40:50] Elliot: and video it
[12/03/2022, 23:40:54] Elliot: I wanna wank
[12/03/2022, 23:40:58] Elliot: He he
[12/03/2022, 23:41:05] Elliot: Oooooo yeah make me cum
[12/03/2022, 23:41:09] Elliot: I’m in bed
[12/03/2022, 23:41:10] Elliot: He he
[12/03/2022, 23:41:18] Elliot: 😉
[12/03/2022, 23:41:21] .: Omg someone just said are you Elliot’s friend I said no
[12/03/2022, 23:41:31] Elliot: Ha ha
[12/03/2022, 23:41:32] .: Your going to fire more like
[12/03/2022, 23:41:38] Elliot: No
[12/03/2022, 23:41:47] Elliot: Thought about it
[12/03/2022, 23:42:05] Elliot: But after last night, never again lol 😣😣😣😣
[12/03/2022, 23:42:28] Elliot: Oops after someone went last night and told us about it I meant
[12/03/2022, 23:42:59] .: Lies lies lies
[12/03/2022, 23:43:11] .: I have spies
[12/03/2022, 23:43:14] .: Hehe
[12/03/2022, 23:43:20] Elliot: Me to
[12/03/2022, 23:43:23] Elliot: 🤗
[12/03/2022, 23:43:26] Elliot: Obviously
‎[12/03/2022, 23:43:35] Elliot: ‎<attached: 00001264-STICKER-2022-03-12-23-43-35.webp>
[12/03/2022, 23:47:28] Elliot: Ok going to put phone in coat check now ooops meant bed 😘😘😜😜
[12/03/2022, 23:47:43] .: Have fun
[12/03/2022, 23:47:48] .: Bye
[12/03/2022, 23:48:10] Elliot: I’m in bed you dozy bitch
[12/03/2022, 23:48:29] .: Lies
‎[12/03/2022, 23:48:37] Elliot: ‎<attached: 00001270-PHOTO-2022-03-12-23-48-37.jpg>
‎[12/03/2022, 23:48:52] Elliot: ‎<attached: 00001271-PHOTO-2022-03-12-23-48-52.jpg>
[12/03/2022, 23:49:00] Elliot: He he 😘😘😘
[12/03/2022, 23:49:10] .: Well you’d know stood next to him and friends with it
[12/03/2022, 23:49:12] .: Slag
[12/03/2022, 23:49:22] Elliot: Ha ha
[12/03/2022, 23:49:27] Elliot: Nite babes
[12/03/2022, 23:49:39] Elliot: Thanks for eagle 🤗😘
‎[14/03/2022, 21:16:36] .: ‎<attached: 00001278-PHOTO-2022-03-14-21-16-36.jpg>
[14/03/2022, 21:16:52] .: Is that Adam who works for Gary
[14/03/2022, 21:16:54] .: Haha
[14/03/2022, 21:17:01] Elliot: Ha ha ha yes
[15/03/2022, 23:09:04] .: Wtf have ……
[16/03/2022, 07:17:03] Elliot: Sleeping babes, just woke up he he
[16/03/2022, 13:58:29] .: Right big gob with big ideas get a iPhone Shane this is not sending me notifications
[16/03/2022, 13:58:35] .: What the fuck is wrong with it
[16/03/2022, 13:58:42] .: Fix it NOwW
[16/03/2022, 17:49:30] Elliot: Omg
[16/03/2022, 17:49:38] Elliot: What’s wrong with it ?
[16/03/2022, 17:50:08] .: See just like these my bestest friend wouldn’t take 55 hours to reply 😡
[16/03/2022, 17:50:20] .: Just not coming through
[16/03/2022, 17:50:27] .: Hacked and robbed
[16/03/2022, 17:50:30] .: By Elliot
[16/03/2022, 17:52:40] Elliot: Ooooo… you pressed wrong button probably
‎[16/03/2022, 17:52:50] Elliot: ‎<attached: 00001294-STICKER-2022-03-16-17-52-50.webp>
‎[16/03/2022, 17:53:05] Elliot: ‎<attached: 00001295-PHOTO-2022-03-16-17-53-05.jpg>
‎[16/03/2022, 18:00:43] .: ‎<attached: 00001296-PHOTO-2022-03-16-18-00-42.jpg>
[16/03/2022, 18:28:15] Elliot: Ha ha yeah
[16/03/2022, 18:28:17] Elliot: You
[16/03/2022, 18:29:19] .: No no no
‎[16/03/2022, 18:29:51] .: ‎<attached: 00001300-PHOTO-2022-03-16-18-29-50.jpg>
[16/03/2022, 18:29:58] .: Stinky bitch
[16/03/2022, 19:12:48] Elliot: Eeeewwww
[16/03/2022, 19:12:58] Elliot: Where’s your cock gone ?
‎[16/03/2022, 19:13:27] .: ‎<attached: 00001304-PHOTO-2022-03-16-19-13-27.jpg>
[16/03/2022, 19:13:46] Elliot: Lol your weird
[16/03/2022, 19:13:50] .: Hehe
‎[16/03/2022, 19:19:31] Elliot: ‎<attached: 00001307-PHOTO-2022-03-16-19-19-31.jpg>
[16/03/2022, 19:19:33] Elliot: He he
[16/03/2022, 19:19:53] .: Who’s that
[16/03/2022, 19:20:38] Elliot: Dette
[16/03/2022, 19:20:49] Elliot: Owner of Electrowerkz
[16/03/2022, 19:21:03] .: Ahh yea all your new friends
[16/03/2022, 19:21:11] Elliot: Our boss
[16/03/2022, 19:21:18] .: Pushing me away again who’s been beside you for years
[16/03/2022, 19:21:21] .: It’s fine
[16/03/2022, 19:21:26] .: Bye
[16/03/2022, 19:21:38] Elliot: No babes….
[16/03/2022, 19:21:41] .: On the floor on my own
[16/03/2022, 19:21:43] Elliot: You pushing us away
[16/03/2022, 19:21:44] .: From now on
[16/03/2022, 19:21:45] Elliot: Bye
[16/03/2022, 19:21:55] Elliot: Ha Hax
[16/03/2022, 19:21:55] .: Just me and the floor
‎[16/03/2022, 19:22:01] Elliot: ‎<attached: 00001324-PHOTO-2022-03-16-19-22-01.jpg>
[16/03/2022, 19:22:02] .: How the fuck is that
[16/03/2022, 19:22:30] .: I asked to meEt you last week you started going on about Curtis and meeting him
[16/03/2022, 19:22:34] Elliot: Same way we are supposed to be doing it to you
[16/03/2022, 19:22:58] .: And I said when I came to yours I want to go out beyond/fire
[16/03/2022, 19:23:02] Elliot: Yeah I needed his rider and production meeting
[16/03/2022, 19:23:04] .: You went with put me
[16/03/2022, 19:23:09] .: Out
[16/03/2022, 19:23:11] Elliot: Omg
[16/03/2022, 19:23:14] .: How dare you
[16/03/2022, 19:23:17] Elliot: When did you say that ?
[16/03/2022, 19:23:24] Elliot: We stayed in on Saturday
[16/03/2022, 19:23:27] .: When I walked out of yours
[16/03/2022, 19:23:34] Elliot: Omfg
[16/03/2022, 19:23:48] Elliot: Could have gone to Heat to
[16/03/2022, 19:23:49] .: Omg that other secret
[16/03/2022, 19:23:51] Elliot: 🙄🙄
[16/03/2022, 19:23:52] .: Yeah
[16/03/2022, 19:23:59] .: But did you remember
[16/03/2022, 19:24:00] .: No
[16/03/2022, 19:24:28] .: Licencing went into GAY and found all mould in ice machine
[16/03/2022, 19:24:57] Elliot: Ha ha yeah but that machine hadn’t been used for years
[16/03/2022, 19:24:58] .: And I was winding you up when I said I told someone about beef mince hehehe
[16/03/2022, 19:25:12] Elliot: Yeah I know
[16/03/2022, 19:25:13] .: Was you wound up lol?
[16/03/2022, 19:25:15] Elliot: He he
[16/03/2022, 19:25:21] .: Lies
[16/03/2022, 19:25:22] Elliot: No
[16/03/2022, 19:25:23] .: Lies
[16/03/2022, 19:25:25] .: Haha
[16/03/2022, 19:25:26] Elliot: Lol
‎[16/03/2022, 19:26:06] Elliot: ‎<attached: 00001355-PHOTO-2022-03-16-19-26-06.jpg>
[16/03/2022, 19:28:13] .: Yeah have fun
[16/03/2022, 19:28:32] Elliot: I’ll be working babes
[16/03/2022, 19:28:45] .: Hmmmmm
[16/03/2022, 19:28:54] .: I may be
[16/03/2022, 19:29:03] Elliot: Where ?
[16/03/2022, 19:29:05] Elliot: Eagle ?
[16/03/2022, 19:29:07] Elliot: Lol
[16/03/2022, 19:29:07] .: Electroworx
[16/03/2022, 19:29:20] Elliot: Yeah Painting the walls he he
[16/03/2022, 19:29:30] .: Throwing drug dealers out….. right Curtis out
[16/03/2022, 19:29:43] Elliot: Ha ha
[16/03/2022, 19:29:52] .: I can paint
[16/03/2022, 19:30:24] Elliot: Good…. There’s lots to paint
[16/03/2022, 19:31:38] .: Il get some professionals in and get quotes tell them to fuck off and Charge their rates
[16/03/2022, 19:43:44] Elliot: Ha ha I’ll be paying so don’t think so babes
[16/03/2022, 19:43:48] Elliot: Need cheap
[16/03/2022, 19:44:05] .: Firework in a can of paint
[16/03/2022, 19:44:08] .: Say no more
[16/03/2022, 19:44:39] .: Actually do you have a room where we could try that
[16/03/2022, 19:44:59] Elliot: Ha ha yes
[16/03/2022, 19:45:04] .: Let’s do it
[16/03/2022, 19:59:04] Elliot: Errrrr no
[17/03/2022, 16:05:21] .: Yea yes yes yes yes yes yes yes yes yes yes Yea yes yes yes yes yes yes yes yes yes yes Yea yes yes yes yes yes yes yes yes yes yes Yea yes yes yes yes yes yes yes yes yes yes Yea yes yes yes yes yes yes yes yes yes yes Yea yes yes yes yes yes yes yes yes yes yes Yea yes yes yes yes yes yes yes yes yes yes Yea yes yes yes yes yes yes yes yes yes yes Yea yes yes yes yes yes yes yes yes yes yes Yea yes yes yes yes yes yes yes yes yes yes Yea yes yes yes yes yes yes yes yes yes yes Yea yes yes yes yes yes yes yes yes yes yes
[17/03/2022, 16:11:06] Elliot: No
[17/03/2022, 18:20:49] .: Why thought
[17/03/2022, 18:21:02] .: Give me Attention NOW
[17/03/2022, 18:22:34] Elliot: I got a hardon
[17/03/2022, 18:22:50] .: Oh that’s fantastic
[17/03/2022, 18:23:05] .: Are you going to give it a review on trip advisor
[17/03/2022, 18:23:06] .: Ey
[17/03/2022, 18:23:25] .: Why is unicorn not at electro on spring
[17/03/2022, 18:23:27] Elliot: Yes
[17/03/2022, 18:23:39] Elliot: It moves between clubs
[17/03/2022, 18:23:42] .: Oh
[17/03/2022, 18:24:28] Elliot: Corsica
[17/03/2022, 18:24:31] Elliot: I think
[17/03/2022, 18:24:47] .: Yeah I was look at the pics last night and seen it was there that’s why I asked
[17/03/2022, 18:25:16] .: Thought they had got banned for another ask for a syringe Sign lol
[17/03/2022, 18:26:04] Elliot: Ha ha no… got Trough next
[17/03/2022, 18:26:29] .: Omg
[17/03/2022, 18:28:08] Elliot: They already had a party there
[17/03/2022, 18:29:59] .: Yeah I went years ago
[17/03/2022, 18:30:09] .: Or nay have been trough
[17/03/2022, 18:32:59] Elliot: Yeah likely to be trough… been going longer
[17/03/2022, 18:39:59] .: Dunno
[17/03/2022, 18:40:09] .: Been to that much shite i forget
[17/03/2022, 18:44:43] Elliot: Ha ha
[17/03/2022, 18:44:48] Elliot: They are all the same
[17/03/2022, 18:45:16] .: Still think about that time you showed me the Dj in xxl
[17/03/2022, 18:45:19] Elliot: Young sexy boys to start then as the party goes on all the old leches go
[17/03/2022, 18:45:43] .: Thought it was just music
[17/03/2022, 18:45:52] Elliot: 🤣🤣🤣🤣🤣🤣
[17/03/2022, 18:46:06] .: Never looked or took notic
[17/03/2022, 18:46:22] Elliot: Lol no one did
[17/03/2022, 18:47:51] .: I’d been going 7 years
[17/03/2022, 18:48:20] .: The piggy Stood at side of me, you finished then?
[17/03/2022, 18:48:23] .: Hahahaha
[17/03/2022, 18:48:38] Elliot: What piggy ?
[17/03/2022, 18:48:44] .: Pigano
[17/03/2022, 18:48:57] Elliot: Oh ha ha
[17/03/2022, 18:49:10] .: He went shade
[17/03/2022, 18:49:18] .: I really didn’t mean it that way lol
[17/03/2022, 18:49:28] Elliot: I’ve done that… took big bump of K and wobble around in a K hole through his whole set
[17/03/2022, 18:49:39] .: Yeah
[17/03/2022, 18:49:46] .: Awww miss them days off
[17/03/2022, 18:49:52] .: Not off
[17/03/2022, 18:49:54] Elliot: Me to
[17/03/2022, 18:49:55] .: Just days
[17/03/2022, 18:50:37] Elliot: Feel it was the nearest I’ve been to a party like xxl
[17/03/2022, 18:51:03] .: What you mean
[17/03/2022, 18:51:45] Elliot: Had the feel of XXL great vibe and up for it crowed
[17/03/2022, 18:52:13] .: Yeah well just buy it and then it can return
[17/03/2022, 18:52:23] .: Remember Randy who we fucked up
[17/03/2022, 18:52:24] Elliot: Ha ha
[17/03/2022, 18:52:25] .: Hehe
[17/03/2022, 18:52:35] Elliot: Omg lol yeah
[17/03/2022, 18:52:37] .: Them pills ok
[17/03/2022, 18:52:39] Elliot: That was funny
[17/03/2022, 18:52:41] .: Yeah fine
[17/03/2022, 18:52:51] Elliot: BAM
[17/03/2022, 18:57:16] .: Sucked his cock later that night
[17/03/2022, 18:57:17] .: Haha
[17/03/2022, 18:57:29] .: Wonder where these people are  now
[17/03/2022, 18:57:40] .: Probably a secure unit or something
[17/03/2022, 18:57:49] Elliot: Eeewwwww  he must have been fucked
[17/03/2022, 18:57:52] .: Traumatised
[17/03/2022, 18:58:02] .: Well I met these two guys
[17/03/2022, 18:58:03] Elliot: Mental home still riding the pill
[17/03/2022, 18:58:06] .: And…….
[17/03/2022, 18:58:15] Elliot: Ha ha
[17/03/2022, 18:58:17] Elliot: LIES
[17/03/2022, 18:58:18] .: I’m still on the floor
[17/03/2022, 18:58:30] Elliot: bam in the cell you go
[17/03/2022, 18:58:32] .: Never seen him before in my life
[17/03/2022, 18:58:43] .: Throw him out fuck him
[17/03/2022, 18:58:50] Elliot: Ha ha
[17/03/2022, 18:58:57] .: Wait fuck him then throw him out
‎[17/03/2022, 19:00:05] Elliot: ‎<attached: 00001453-STICKER-2022-03-17-19-00-05.webp>
[17/03/2022, 19:01:17] .: What happens with E1
[17/03/2022, 19:03:30] Elliot: What you mean ?
[17/03/2022, 19:04:00] .: Wasn’t you looking at taking over that
[17/03/2022, 19:04:08] Elliot: No babes
[17/03/2022, 19:04:20] .: Oh that party that I remember
[17/03/2022, 19:04:27] Elliot: Just putting on x-mn there
[17/03/2022, 19:04:32] .: That’s it
[17/03/2022, 19:05:05] Elliot: Glad we didn’t… their drinks prices are crazy
[17/03/2022, 19:05:19] .: Been on my meds 3 months now my memory is starting to come back to normal
[17/03/2022, 19:05:32] Elliot: Lol oh good
‎[17/03/2022, 19:05:43] Elliot: ‎<attached: 00001464-STICKER-2022-03-17-19-05-43.webp>
[17/03/2022, 19:08:37] Elliot: 1st April… Beefmince
[17/03/2022, 19:08:44] Elliot: BAM
[17/03/2022, 19:08:57] .: Let’s go
[17/03/2022, 19:10:23] Elliot: Yes, that’s the plan
[17/03/2022, 19:10:26] Elliot: BUT
[17/03/2022, 19:11:05] Elliot: we have to do some work also… like getting a pic of there bar prices and seeing what stock they have behind the bars
[17/03/2022, 19:11:29] .: Well then you can go into the rvt any time because it’s all the same
[17/03/2022, 19:11:31] .: Lol
[17/03/2022, 19:11:41] .: They only take what’s on the door
[17/03/2022, 19:12:17] Elliot: No I want the bar prices and what stock they sell…
[17/03/2022, 19:12:28] Elliot: I’m obsessed with that now
[17/03/2022, 19:12:40] Elliot: Just put Electrowerkz prices up
[17/03/2022, 19:13:21] .: Yeah it’s same any night so it’s not essential to make sure you clock everything lol
[17/03/2022, 19:13:51] .: I can go in and take a pic of the price list and then tell them
To mind there own fucking business
[17/03/2022, 19:13:55] Elliot: Ok good… go now and take pics so we can just go get trashed and judge
[17/03/2022, 19:14:01] .: Hehe
[17/03/2022, 19:14:06] Elliot: Ha ha yes
[17/03/2022, 19:14:42] Elliot: Get the publican of the year to take a pic of eagles
[17/03/2022, 19:14:47] Elliot: He he
[17/03/2022, 19:20:16] .: Lol
[17/03/2022, 19:20:26] .: It’s 5.30 a pint
[17/03/2022, 19:20:42] Elliot: Is it ?
[17/03/2022, 19:20:47] .: Or 80
[17/03/2022, 19:20:51] Elliot: Omg
[17/03/2022, 19:21:02] Elliot: £6
[17/03/2022, 19:22:03] .: Well it’s something a business should work out based on their costs not what up the road is charging lol it’s 6 in soho for a pint Compton’s was 4.90
[17/03/2022, 19:22:24] .: Sophie’s restaurant is £6
[17/03/2022, 19:22:47] Elliot: Shiva jqdvjdvecanxev round the fucking corner is £100
‎[17/03/2022, 19:23:20] .: ‎<attached: 00001493-PHOTO-2022-03-17-19-23-20.jpg>
[17/03/2022, 19:23:51] Elliot: What wattage is your microwave
[17/03/2022, 19:23:51] .: What the fuck does that 😭 mean
[17/03/2022, 19:24:07] .: 800 I know that but it don’t make sense
[17/03/2022, 19:25:11] .: 4 mins then 2 then peel and stir then and other 2
[17/03/2022, 19:25:33] .: Why the fuck don’t hey just say 6 mins at the start
[17/03/2022, 19:25:35] Elliot: Full power 3 mins 30
[17/03/2022, 19:25:43] .: No
[17/03/2022, 19:25:49] .: 800 I’m 4 mins
[17/03/2022, 19:25:59] Elliot: Peel back and full power 2 min
[17/03/2022, 19:26:22] Elliot: Stand 1 min
[17/03/2022, 19:26:23] .: That’s a printing error
[17/03/2022, 19:26:47] Elliot: No 4 or 3 mins
[17/03/2022, 19:27:07] .: There’s 3 time bands
[17/03/2022, 19:27:09] Elliot: Depends on wattage
[17/03/2022, 19:27:15] Elliot: 800 or 900
[17/03/2022, 19:27:18] Elliot: 🤗
[17/03/2022, 19:27:26] .: It’s 4 or 3 1/1
[17/03/2022, 19:27:29] .: 1/2
[17/03/2022, 19:27:32] .: Then 2
[17/03/2022, 19:27:38] .: The peel
[17/03/2022, 19:27:42] .: Then another 2
[17/03/2022, 19:27:45] Elliot: 4-2-2-1
[17/03/2022, 19:27:50] .: Fucking stupids
[17/03/2022, 19:28:00] Elliot: 4
[17/03/2022, 19:28:05] Elliot: 2 peel
[17/03/2022, 19:28:07] Elliot: 2
[17/03/2022, 19:28:11] Elliot: 1 stand
[17/03/2022, 19:28:18] Elliot: 800 w
[17/03/2022, 19:28:24] Elliot: DO IT NOW
[17/03/2022, 19:28:30] .: Yeah so just ducking 6
[17/03/2022, 19:28:33] .: Bastards
[17/03/2022, 19:29:11] .: It’s getting 4 then peel then 4
[17/03/2022, 19:30:47] Elliot: Omg you will die
[17/03/2022, 19:30:51] Elliot: Food poisoning
[17/03/2022, 19:31:06] .: Yay
‎[17/03/2022, 19:31:16] Elliot: ‎<attached: 00001529-STICKER-2022-03-17-19-31-16.webp>
[17/03/2022, 19:31:28] Elliot: Ok just poo yourself then
[18/03/2022, 13:55:15] Elliot: Omfg
[18/03/2022, 13:55:20] Elliot: Council tax
[18/03/2022, 13:55:23] Elliot: 😣
[18/03/2022, 15:11:07] .: What
[18/03/2022, 15:11:18] .: Not had mine yet
[18/03/2022, 15:11:39] Elliot: Gone up babes
[18/03/2022, 15:11:48] .: What’s yours
[18/03/2022, 15:11:59] Elliot: Gone up £56
[18/03/2022, 15:12:06] .: A year
[18/03/2022, 15:12:10] Elliot: 😵‍💫😵‍💫
[18/03/2022, 15:12:16] Elliot: Yeah…
[18/03/2022, 15:12:32] .: Mine will be 5£
[18/03/2022, 15:12:33] Elliot: £1359.00 something
[18/03/2022, 15:12:44] .: Mines 789
[18/03/2022, 15:12:49] Elliot: Omg
[18/03/2022, 15:12:54] .: Or something like that
[18/03/2022, 15:13:16] .: Westminster cheapest on the land
[18/03/2022, 15:13:33] Elliot: Conservative
[18/03/2022, 15:13:39] .: True
[18/03/2022, 15:13:55] Elliot: Fucking Camden corrupt Labour cunts
[18/03/2022, 15:14:00] .: U labour giving it all out to the brave people
‎[18/03/2022, 15:14:15] .: ‎<attached: 00001552-PHOTO-2022-03-18-15-14-15.jpg>
[18/03/2022, 15:14:47] Elliot: Over spend on the shitty things and everyone complains “oh it’s a scandal” etc etc but vote the cunts back in !!!! 🙄🙄🙄
[18/03/2022, 15:15:20] Elliot: Lol. She’s a house sitter now… new business babes
[18/03/2022, 15:15:34] .: We have the pile of soil to pay for at Marble Arch
[18/03/2022, 15:16:26] Elliot: Ha ha ha ha
[18/03/2022, 15:16:29] Elliot: Yeah
[18/03/2022, 15:48:14] Elliot: Bought you some socks
‎[18/03/2022, 15:48:19] Elliot: ‎<attached: 00001559-PHOTO-2022-03-18-15-48-19.jpg>
[18/03/2022, 15:48:53] .: Omg you seen his r shirts
[18/03/2022, 15:48:55] .: T
[18/03/2022, 15:49:01] .: Fucking filth
[18/03/2022, 15:49:04] Elliot: Ha ha yeah
[18/03/2022, 15:49:08] Elliot: I like ‘em
[18/03/2022, 15:49:11] .: I like Ashley
[18/03/2022, 15:49:15] Elliot: Might buy some for work ha ha ha
[18/03/2022, 15:49:25] Elliot: He’s a dirty pig ha
[18/03/2022, 15:49:28] Elliot: I like him to
[18/03/2022, 15:49:31] .: Yup
[18/03/2022, 15:49:37] Elliot: He always says hello
‎[18/03/2022, 15:51:00] Elliot: ‎<attached: 00001571-PHOTO-2022-03-18-15-51-00.jpg>
[18/03/2022, 16:23:08] .: Oooo
[18/03/2022, 17:53:12] .: Wtf are you doing
[18/03/2022, 17:53:46] Elliot: Management meeting babes
[18/03/2022, 17:53:51] .: Omg
[18/03/2022, 17:54:06] Elliot: All go now… got a take over date 😉👍🏻
[18/03/2022, 17:54:10] .: Ooooo
[18/03/2022, 17:54:15] .: NOw
[18/03/2022, 18:03:27] .: Do you want my personal licence now or later
[18/03/2022, 18:03:42] .: And measurements for my suits ?
[18/03/2022, 18:06:55] Elliot: Ooo yes
[18/03/2022, 18:07:09] Elliot: Can you start tomorrow ?
[18/03/2022, 18:07:15] .: No
[18/03/2022, 18:07:19] .: On a date
[18/03/2022, 18:07:27] Elliot: SACKED
‎[18/03/2022, 18:07:34] .: ‎<attached: 00001586-PHOTO-2022-03-18-18-07-33.jpg>
[18/03/2022, 18:07:49] .: When I was fat and Russian
[18/03/2022, 18:08:07] Elliot: Omg
[18/03/2022, 18:08:17] .: Sacked for being Russian
[18/03/2022, 18:08:19] .: B
[18/03/2022, 18:08:22] .: A
[18/03/2022, 18:08:24] .: M
[18/03/2022, 18:08:30] .: Sanctioned
[18/03/2022, 18:09:02] Elliot: What did I not know you had one of these ?
[18/03/2022, 18:09:14] .: I’ve told you before
[18/03/2022, 18:09:43] Elliot: Oh I wasn’t listening ha ha
[18/03/2022, 18:09:47] .: Never are
[18/03/2022, 18:13:16] .: Your friend has slipped up babes
[18/03/2022, 18:14:07] .: And well you too
[18/03/2022, 18:22:44] Elliot: Ha ha
[18/03/2022, 18:23:04] .: Ha ha ?
[18/03/2022, 18:25:42] .: Well I know you have got your own little chat group between you all, but what I wanna know is why I’m topic of the conversation? Why’s that pic been sent to others
[18/03/2022, 18:26:38] Elliot: Lol… Lucy said you looked like someone… then I showed little legs you had a drink License
[18/03/2022, 18:26:46] Elliot: So your mister popular
[18/03/2022, 18:26:52] .: Hmmmm
[18/03/2022, 18:27:05] Elliot: He he
[18/03/2022, 18:28:20] .: Think I’m daft
[18/03/2022, 18:29:52] Elliot: Omg… take another pill
[18/03/2022, 18:30:50] .: Don’t need them babes. And don’t take the poss out of me because of that either.
‎[18/03/2022, 18:34:41] .: ‎<attached: 00001610-PHOTO-2022-03-18-18-34-41.jpg>
[18/03/2022, 18:34:52] .: Looks like me sounds like you lot lol
[18/03/2022, 18:47:24] Elliot: Omg you turning all woke
[18/03/2022, 18:49:17] .: I’m not I’m getting pissed off with being shit on by people who are supposed to be friend when I’ve done fuck all wrong to them.
[18/03/2022, 18:51:43] Elliot: Babes… I’ve been here all the time… I’ve not, nore will I shit on you, I just give you space to do what you need to do ❤️
[18/03/2022, 19:38:50] .: Bollock
[18/03/2022, 19:43:09] Elliot: Omg
‎[18/03/2022, 19:47:40] Elliot: ‎video omitted
[18/03/2022, 19:50:09] .: Yes it was space I needed during the pandemic, so I could deal with the fact I knew my mum would die and issues I had to deal with, what’s caused this atmosphere there seems to be. I never ignored any of you I just didn’t want to see a message or call from my sister so I ignored my phone as much as I could that’s all. Since then there’s been an atmosphere Gio doesn’t speak and not do Leanne or Curtis and I don’t know what I’ve done other than grieve my mum In my way and I felt guilty at times doing that, scared too as well because if I didn’t know as much as I do I’d think you’d have fell out long before now, I get the feeling that’s what you want for some reason and that wasn’t meant for me that message earlier and I’ve been there through that least 8 friends ships you’ve just disposed of for god know what reasons I know how it goes.
[18/03/2022, 20:02:44] Elliot: Ooooook…. Listen, we are always here for you, “friends” come and go those that go aren’t real friends, Gio I think is off on his own path, I haven’t spoke with him for an age either…. Curtis and Leanne are off with all the gay lot now, we to have been left on the side,  but you, you are always there and hopefully always will be.. there’s no atmosphere between us, why would there be, we have all gone through tough times in the last 2 years, you more so. 
Don’t think we have issues, we haven’t… god sake I need someone to judge people with… especially if we’re going Beefmince on the 1st lol
[18/03/2022, 20:06:01] Elliot: I guess I’ve been a bit shoddy with everything lately, just had a lot on with this take over thing… but that’s all… you are part of our plans, friends and part of the future of the club 🤗
‎[21/03/2022, 19:46:26] Elliot: ‎video omitted
[22/03/2022, 11:28:40] Elliot: Hi ya… you still wanna go Beefmince? 
Let me know and I’ll get tickets 🤗
‎[26/03/2022, 18:59:52] .: ‎<attached: 00001623-PHOTO-2022-03-26-18-59-52.jpg>
[26/03/2022, 19:00:21] Elliot: Aaaahhhh she’s alive !!!
‎[26/03/2022, 19:00:23] Elliot: ‎<attached: 00001625-STICKER-2022-03-26-19-00-23.webp>
[26/03/2022, 19:01:51] Elliot: Ok…. Rocket man will have killed us all by next Friday… I’ll take my chances babes 💅🏻
‎[26/03/2022, 19:01:55] Elliot: ‎<attached: 00001627-STICKER-2022-03-26-19-01-55.webp>
[27/03/2022, 03:19:24] .: Yeah die bye
[27/03/2022, 03:19:46] Elliot: Omg
‎[27/03/2022, 03:19:57] Elliot: ‎<attached: 00001630-STICKER-2022-03-27-03-19-57.webp>
[27/03/2022, 06:59:19] .: I may have plans what don’t include you and legs at the club
[27/03/2022, 06:59:31] .: Tut tut tut
[27/03/2022, 07:06:31] .: Lol
[27/03/2022, 07:09:18] Elliot: Ooooo ok put it in writing and it can be discussed in the bord room
‎[27/03/2022, 07:09:50] Elliot: ‎video omitted
[27/03/2022, 07:10:35] .: Wasn’t allowed to take pics in fire
[27/03/2022, 07:10:49] .: Fucking filth like you bye die
[27/03/2022, 07:10:51] Elliot: Eeeewwww
[27/03/2022, 07:11:10] Elliot: Wasn’t allowed to take pics here either
‎[27/03/2022, 07:11:50] Elliot: ‎<attached: 00001640-PHOTO-2022-03-27-07-11-50.jpg>
‎[27/03/2022, 14:40:36] Elliot: ‎video omitted
[27/03/2022, 14:40:42] Elliot: You
[30/03/2022, 07:02:07] .: So after much thought and prayer il accept your apology and forgive you. I hope this is a lesson learned on what a national treasure you could have lost
[30/03/2022, 07:02:18] .: You little bitch
[30/03/2022, 07:10:07] .: Wake up then and accept it
[30/03/2022, 07:10:13] .: NOW
[30/03/2022, 07:29:08] Elliot: Omg
‎[30/03/2022, 07:29:22] Elliot: ‎<attached: 00001648-STICKER-2022-03-30-07-29-22.webp>
[30/03/2022, 07:29:33] .: NO
[30/03/2022, 07:30:15] Elliot: No what ?
‎[30/03/2022, 07:30:58] Elliot: ‎<attached: 00001651-PHOTO-2022-03-30-07-30-58.jpg>
[30/03/2022, 07:31:15] .: Nasty
[30/03/2022, 07:31:22] .: Be nice
‎[30/03/2022, 07:31:51] Elliot: ‎<attached: 00001654-STICKER-2022-03-30-07-31-51.webp>
[30/03/2022, 07:32:04] .: Little bitch
[30/03/2022, 07:32:12] Elliot: Have you found Jesus
[30/03/2022, 07:32:32] .: No just in a nice mood
[30/03/2022, 07:32:39] .: Don’t start
[30/03/2022, 07:32:41] Elliot: Oh ok
[30/03/2022, 07:32:46] Elliot: Good
‎[30/03/2022, 07:33:37] .: ‎<attached: 00001661-PHOTO-2022-03-30-07-33-37.jpg>
[30/03/2022, 07:34:02] Elliot: Lol
‎[30/03/2022, 08:13:52] Elliot: ‎<attached: 00001663-PHOTO-2022-03-30-08-13-52.jpg>
‎[30/03/2022, 08:14:24] .: ‎<attached: 00001664-PHOTO-2022-03-30-08-14-24.jpg>
[30/03/2022, 08:14:49] .: It’s your fillers what have caused it to fucking sink
[30/03/2022, 08:14:50] Elliot: Omg is that Madonna ?
[30/03/2022, 08:15:07] .: Yeah
[30/03/2022, 08:15:23] Elliot: Or Micheal Jackson
[30/03/2022, 08:15:39] .: Andrew
[30/03/2022, 08:15:52] Elliot: 😱
‎[30/03/2022, 08:16:32] Elliot: ‎<attached: 00001671-PHOTO-2022-03-30-08-16-32.jpg>
‎[30/03/2022, 08:17:05] .: ‎<attached: 00001672-PHOTO-2022-03-30-08-17-05.jpg>
[30/03/2022, 08:17:32] Elliot: 🤣🤣🤣🤣🤣🤣🤣
[30/03/2022, 08:17:40] Elliot: That always makes me laugh
[30/03/2022, 08:17:47] Elliot: Send it him
[30/03/2022, 08:17:49] Elliot: Lol
[30/03/2022, 08:18:20] .: Was he trying to be Ron then
[30/03/2022, 08:18:48] Elliot: Yes.. all butch and dominating on holiday
‎[30/03/2022, 08:19:32] .: ‎<attached: 00001679-PHOTO-2022-03-30-08-19-31.jpg>
[30/03/2022, 08:19:52] .: Ron Jeremy water sports
[30/03/2022, 08:19:54] Elliot: Lol
[30/03/2022, 09:41:18] .: Disgraceful
‎[30/03/2022, 09:56:09] Elliot: ‎<attached: 00001683-STICKER-2022-03-30-09-56-09.webp>
[30/03/2022, 09:56:30] .: Omg is that that Wyndham
[30/03/2022, 09:56:40] .: Does he still comment on shit
[30/03/2022, 09:56:54] Elliot: No so much now…
[30/03/2022, 09:57:03] Elliot: Wait till the next election ha ha
[30/03/2022, 09:57:10] .: Still moaning about stuff
[30/03/2022, 09:57:13] Elliot: Yes
[30/03/2022, 09:57:20] .: Twitter is better
[30/03/2022, 09:57:26] Elliot: Thinks Egg is the best club in the world etc
[30/03/2022, 09:57:35] Elliot: Never had twitter
[30/03/2022, 09:57:51] .: Just told a SCOUSE to put himself a step up the victim list
[30/03/2022, 09:57:53] .: Heheh
[30/03/2022, 09:57:59] .: Omfg is unreal
[30/03/2022, 09:58:12] Elliot: I’ve got to stay neutral on things now anyway… I’ve been told lol
[30/03/2022, 09:58:21] .: By who
[30/03/2022, 09:58:24] Elliot: Omg ha ha
[30/03/2022, 09:58:29] Elliot: Little legs
[30/03/2022, 09:58:38] .: Let’s just hope no one digs up you’re past lol
[30/03/2022, 09:58:41] .: Omg
[30/03/2022, 09:58:47] Elliot: I’ll have to set up another FB account lol
[30/03/2022, 09:59:01] Elliot: Lol
[30/03/2022, 09:59:13] .: You need to be a silent lol
[30/03/2022, 09:59:21] Elliot: 😣
[30/03/2022, 09:59:24] .: Silent owners
[30/03/2022, 09:59:25] .: Omg
[30/03/2022, 09:59:28] Elliot: Don’t know if I can ha ha
[30/03/2022, 10:00:02] .: Wait till lefties find out all there parties will move lol
[30/03/2022, 10:00:21] Elliot: Ha ha omg yeah… I’ve canceled some already ha ha
[30/03/2022, 10:00:22] .: Pagano wil be telling everyone
[30/03/2022, 10:00:36] Elliot: At his Wiled boys party
[30/03/2022, 10:00:37] .: Girl hitler youth now own that club
[30/03/2022, 10:00:39] Elliot: 🤮
[30/03/2022, 10:00:53] Elliot: Lol
[30/03/2022, 10:00:54] .: Lol
[30/03/2022, 10:01:05] Elliot: I’m the canceled queen
[30/03/2022, 10:01:18] .: Omg yay
[30/03/2022, 10:01:30] .: It’s nice being cancelled actually
[30/03/2022, 10:01:38] Elliot: Oh but we paid a deposit…. Have it back… BAM
[30/03/2022, 10:02:06] Elliot: but why ? 
Your party is shit… bye
[30/03/2022, 10:02:17] Elliot: Got to sack someone today
[30/03/2022, 10:02:18] Elliot: Ha ha
[30/03/2022, 10:02:22] .: Your have reached the untlimate goal by pissing  people of to  the max as much as possible
[30/03/2022, 10:02:29] .: Why
[30/03/2022, 10:02:31] Elliot: He he
[30/03/2022, 10:02:35] .: When do you take over
[30/03/2022, 10:02:37] Elliot: Drunk on duty
[30/03/2022, 10:03:08] Elliot: 14th properly, the team move in, but I’ve taken over already
[30/03/2022, 10:03:37] .: Sack yourself
[30/03/2022, 10:03:39] .: Bam
[30/03/2022, 10:03:46] .: Is Lucy leaving egg
[30/03/2022, 10:03:52] Elliot: Lol yeah… that’s to come
[30/03/2022, 10:03:55] Elliot: Yes
[30/03/2022, 10:04:00] .: Omg
[30/03/2022, 10:04:02] Elliot: But that’s top secret
[30/03/2022, 10:04:04] Elliot: And
[30/03/2022, 10:04:17] Elliot: We are having a chat with Shuvo later today he he
[30/03/2022, 10:04:23] .: Who
[30/03/2022, 10:04:23] Elliot: BAM
[30/03/2022, 10:04:32] Elliot: egg’s Bar manager
[30/03/2022, 10:04:34] Elliot: Shuvo
[30/03/2022, 10:04:36] .: Oh
[30/03/2022, 10:04:41] .: Forgot him
[30/03/2022, 10:04:44] Elliot: Lol
[30/03/2022, 10:05:03] Elliot: He would be good because he will bring all the Indians with him
[30/03/2022, 10:05:05] Elliot: Lol
[30/03/2022, 10:05:08] .: I’ve not decided my role
[30/03/2022, 10:05:32] Elliot: Ok, well, let us know what you have so we can get your business cards printed
